{
  "case_number": "Ä 3457-24",
  "nickname": "”GDPR och brottmålsdomarna\" (I och II)",
  "summary": "Sekretess enligt 21 kap. 7 § offentlighets- och sekretesslagen. Med hänsyn till reglerna i EU:s dataskyddsförordning har sekretess ansetts föreligga när ett företag begärt ut ett större antal domar och andra handlingar i brottmål, trots att företagets verksamhet omfattats av grundlagsskydd. – Eftersom företaget bedriver journalistisk verksamhet har handlingarna lämnats ut med förbehåll. (I och II) ",
  "decision_date": "2025-02-25",
  "publication_time": "2025-04-12T05:59:00",
  "case_id": "5a70db8b-8770-4f78-8ea3-31d782ae2353",
  "type": "DOM_ELLER_BESLUT",
  "is_precedent": true,
  "court": "Högsta domstolen",
  "court_code": "HDO",
  "keywords": [
    "Dataskydd",
    "Allmänna handlingar",
    "Sekretess",
    "Förbehåll"
  ],
  "legal_areas": [],
  "legal_references": [
    {
      "reference": "10 kap. 14 § offentlighets- och sekretesslagen (2009:400)",
      "sfs_number": "2009:400"
    },
    {
      "reference": "21 kap. 7 § offentlighets- och sekretesslagen (2009:400)",
      "sfs_number": "2009:400"
    },
    {
      "reference": "1 kap. 7 § lagen (2018:218) med kompletterande bestämmelser till EU:s dataskyddsförordning",
      "sfs_number": "2018:218"
    },
    {
      "reference": "Europaparlamentets och rådets förordning (EU) 2016/679 av den 27 april 2016 om skydd för fysiska personer med avseende på behandling av personuppgifter och om det fria flödet av sådana uppgifter och om upphävande av direktiv 95/46/EG (allmän dataskyddsförordning)",
      "sfs_number": ""
    }
  ],
  "referenced_publications": [
    "”Stiftelsens webbplats” NJA 2001 s. 409",
    "”Hovrättens dagboksblad” NJA 2015 s. 180",
    "EU-domstolens dom av den 16 december 2008, Satakunnan Markkinapörssi och Satamedia, C-73/07, EU:C:2008:727",
    "EU-domstolens dom av den 24 september 2019, GC m.fl., C-136/17, EU:C:2019:773",
    "EU-domstolens dom av den 22 juni 2021, Latvijas Republikas Saeima, C-439/19, EU:C:2021:504",
    "EU-domstolens dom av den 7 mars 2024, C-740/22, Endemol Shine Finland, EU:C:2024:216"
  ],
  "pdf_documents": [
    {
      "filename": "I   Ä 3457-24.pdf",
      "file_id": "190/c0/f4/c0f49f1a-0487-419c-8517-cfc70c7418dc"
    },
    {
      "filename": "II   Ä 3169-24.pdf",
      "file_id": "190/3a/86/3a8643e3-f89b-4ba3-8673-35f44e958b91"
    }
  ],
  "case_url": "https://rattspraxis.etjanst.domstol.se/sok/publicering/8648c5ce-ae20-41ef-ab04-85cd5b0797f0",
  "correlation_number": "8648c5ce-ae20-41ef-ab04-85cd5b0797f0",
  "full_text": "Sök rättspraxis\nTillbaka\nSkriv ut\nOm avgörandet\nDomstol:\nHögsta domstolen\nMålnummer:\nÄ 3457-24\nÄ 3169-24\nAvgörandedatum:\n2025-02-25\nEuroparättsligt avgörande:\nJa\nLagrum\n10 kap. 14 § offentlighets- och sekretesslagen (2009:400)\n2009:400\n21 kap. 7 § offentlighets- och sekretesslagen (2009:400)\n2009:400\n1 kap. 7 § lagen (2018:218) med kompletterande bestämmelser till EU:s dataskyddsförordning\n2018:218\nEuropaparlamentets och rådets förordning (EU) 2016/679 av den 27 april 2016 om skydd för fysiska personer med avseende på behandling av personuppgifter och om det fria flödet av sådana uppgifter och om upphävande av direktiv 95/46/EG (allmän dataskyddsförordning)\nHänvisade rättsfall\n”Stiftelsens webbplats” NJA 2001 s. 409\n”Hovrättens dagboksblad” NJA 2015 s. 180\nEU-domstolens dom av den 16 december 2008, Satakunnan Markkinapörssi och Satamedia, C-73/07, EU:C:2008:727\nEU-domstolens dom av den 24 september 2019, GC m.fl., C-136/17, EU:C:2019:773\nEU-domstolens dom av den 22 juni 2021, Latvijas Republikas Saeima, C-439/19, EU:C:2021:504\nEU-domstolens dom av den 7 mars 2024, C-740/22, Endemol Shine Finland, EU:C:2024:216\nNyckelord\nDataskydd\nAllmänna handlingar\nSekretess\nFörbehåll\nÄ 3457-24, Ä 3169-24\n”GDPR och brottmålsdomarna\" (I och II)\nSekretess enligt 21 kap. 7 § offentlighets- och sekretesslagen. Med hänsyn till reglerna i EU:s dataskyddsförordning har sekretess ansetts föreligga när ett företag begärt ut ett större antal domar och andra handlingar i brottmål, trots att företagets verksamhet omfattats av grundlagsskydd. – Eftersom företaget bedriver journalistisk verksamhet har handlingarna lämnats ut med förbehåll. (I och II)\n- Visa mindre innehåll\nDom eller beslut\npicture_as_pdf\nI Ä 3457-24.pdf\narrow_forward\nÖppnas i en ny flik\npicture_as_pdf\nII Ä 3169-24.pdf\narrow_forward\nÖppnas i en ny flik\nKontakt\nFrågor och svar\nTillgänglighet\nPrenumerera på RSS-flöde"
}