{
  "case_number": "Ä 7651-23",
  "nickname": "\"Anteckningen om hembudsförbehåll\"",
  "summary": "Anteckning i fastighetsregistret. Vid gåva av en fastighetsandel ska ett hembudsförbehåll till förmån för andra gåvotagare anses ha förlorat sin betydelse när hela fastigheten har kommit i en och samma ägares hand, om det inte tydligt följer av gåvobrevet att givaren avsett något annat. En anteckning i fastighetsregistret om förbehållet har då uppenbarligen inte längre någon betydelse och ska därför tas bort.",
  "decision_date": "2025-01-22",
  "publication_time": "2025-03-04T15:55:00",
  "case_id": "905883e7-d274-4175-93bc-12f32dc6bb5c",
  "type": "DOM_ELLER_BESLUT",
  "is_precedent": true,
  "court": "Högsta domstolen",
  "court_code": "HDO",
  "keywords": [
    "Fastighetsregister",
    "Anteckning i fastighetsregistret",
    "Gåvobrev",
    "Hembudsförbehåll",
    "Hembudsskyldighet"
  ],
  "legal_areas": [],
  "legal_references": [
    {
      "reference": "19 kap. 30 § jordabalken (1970:994)",
      "sfs_number": "1970:994"
    }
  ],
  "referenced_publications": [
    "Hembudsanteckningen i fastighetsboken” NJA 1981 s. 897",
    "”Samägandet och hembudet” NJA 2017 s. 550",
    "”Det förkomna gåvobrevet” NJA 2017 s. 1045",
    "”Orrögåvan” NJA 2021 s. 709"
  ],
  "pdf_documents": [
    {
      "filename": "Ä 7651-23.pdf",
      "file_id": "190/de/05/de05400c-fd88-447c-87b2-052d1dbf9498"
    }
  ],
  "case_url": "https://rattspraxis.etjanst.domstol.se/sok/publicering/1521cbfd-5b60-43e7-b80e-a311f47549db",
  "correlation_number": "1521cbfd-5b60-43e7-b80e-a311f47549db",
  "full_text": "Sök rättspraxis\nTillbaka\nSkriv ut\nOm avgörandet\nDomstol:\nHögsta domstolen\nMålnummer:\nÄ 7651-23\nAvgörandedatum:\n2025-01-22\nLagrum\n19 kap. 30 § jordabalken (1970:994)\n1970:994\nHänvisade rättsfall\nHembudsanteckningen i fastighetsboken” NJA 1981 s. 897\n”Samägandet och hembudet” NJA 2017 s. 550\n”Det förkomna gåvobrevet” NJA 2017 s. 1045\n”Orrögåvan” NJA 2021 s. 709\nNyckelord\nFastighetsregister\nAnteckning i fastighetsre...\nGåvobrev\nHembudsförbehåll\nHembudsskyldighet\nÄ 7651-23\n\"Anteckningen om hembudsförbehåll\"\nAnteckning i fastighetsregistret. Vid gåva av en fastighetsandel ska ett hembudsförbehåll till förmån för andra gåvotagare anses ha förlorat sin betydelse när hela fastigheten har kommit i en och samma ägares hand, om det inte tydligt följer av gåvobrevet att givaren avsett något annat. En anteckning i fastighetsregistret om förbehållet har då uppenbarligen inte längre någon betydelse och ska därför tas bort.\nDom eller beslut\npicture_as_pdf\nÄ 7651-23.pdf\narrow_forward\nÖppnas i en ny flik\nKontakt\nFrågor och svar\nTillgänglighet\nPrenumerera på RSS-flöde"
}