{
  "case_number": "Ä 7609-24",
  "nickname": "”Den polska fängelsedomen”",
  "summary": "Fråga om det finns särskilda skäl att, med hänsyn till barns bästa, erkänna och verkställa ett utländskt fängelsestraff trots att kravet på dubbel straffbarhet inte är uppfyllt.",
  "decision_date": "2025-04-16",
  "publication_time": "2025-04-16T11:45:00",
  "case_id": "a6e57baf-3a3b-4061-919a-aa9c368ea4d5",
  "type": "DOM_ELLER_BESLUT",
  "is_precedent": true,
  "court": "Högsta domstolen",
  "court_code": "HDO",
  "keywords": [
    "Erkännande och verkställighet av fängelsestraff",
    "Dubbel straffbarhet",
    "Barns bästa"
  ],
  "legal_areas": [],
  "legal_references": [
    {
      "reference": "3 kap. 1 §§ lagen (2015:96) om erkännande och verkställighet av frihetsberövande påföljder inom Europeiska unionen samt artikel 3 i barnkonventionen",
      "sfs_number": "2015:96"
    },
    {
      "reference": "3 kap. 4 §§ lagen (2015:96) om erkännande och verkställighet av frihetsberövande påföljder inom Europeiska unionen samt artikel 3 i barnkonventionen",
      "sfs_number": "2015:96"
    },
    {
      "reference": "3 kap. 5 §§ lagen (2015:96) om erkännande och verkställighet av frihetsberövande påföljder inom Europeiska unionen samt artikel 3 i barnkonventionen",
      "sfs_number": "2015:96"
    }
  ],
  "referenced_publications": [
    "”Mammans näringspenningtvätt” NJA 2024 s. 642 ",
    "EU-domstolens dom GN, C-261/22",
    "EU:C:2023:1017"
  ],
  "pdf_documents": [
    {
      "filename": "Ä 7609-24.pdf",
      "file_id": "190/70/de/70de0182-2e88-4dbf-aa2b-1263489cc228"
    }
  ],
  "case_url": "https://rattspraxis.etjanst.domstol.se/sok/publicering/35af097e-a322-4b11-a966-f302637505f8",
  "correlation_number": "35af097e-a322-4b11-a966-f302637505f8",
  "full_text": "Sök rättspraxis\nTillbaka\nSkriv ut\nOm avgörandet\nDomstol:\nHögsta domstolen\nMålnummer:\nÄ 7609-24\nAvgörandedatum:\n2025-04-16\nEuroparättsligt avgörande:\nJa\nLagrum\n3 kap. 1 §§ lagen (2015:96) om erkännande och verkställighet av frihetsberövande påföljder inom Europeiska unionen samt artikel 3 i barnkonventionen\n2015:96\n3 kap. 4 §§ lagen (2015:96) om erkännande och verkställighet av frihetsberövande påföljder inom Europeiska unionen samt artikel 3 i barnkonventionen\n2015:96\n3 kap. 5 §§ lagen (2015:96) om erkännande och verkställighet av frihetsberövande påföljder inom Europeiska unionen samt artikel 3 i barnkonventionen\n2015:96\nHänvisade rättsfall\n”Mammans näringspenningtvätt” NJA 2024 s. 642\nEU-domstolens dom GN, C-261/22\nEU:C:2023:1017\nNyckelord\nErkännande och verkställi...\nDubbel straffbarhet\nBarns bästa\nÄ 7609-24\n”Den polska fängelsedomen”\nFråga om det finns särskilda skäl att, med hänsyn till barns bästa, erkänna och verkställa ett utländskt fängelsestraff trots att kravet på dubbel straffbarhet inte är uppfyllt.\nDom eller beslut\npicture_as_pdf\nÄ 7609-24.pdf\narrow_forward\nÖppnas i en ny flik\nKontakt\nFrågor och svar\nTillgänglighet\nPrenumerera på RSS-flöde"
}