{
  "case_number": "T 2839-24",
  "nickname": "”Uteslutningen ur bolaget”",
  "summary": "Det är möjligt att utesluta flera bolagsmän samtidigt ur ett enkelt bolag. Kravet på att övriga bolagsmän ska vara ense för att uteslutning ska kunna ske omfattar inte de bolagsmän som begärs uteslutna, under förutsättning att de har en likvidationsgrund hänförlig till sig.",
  "decision_date": "2025-04-29",
  "publication_time": "2025-04-29T08:45:00",
  "case_id": "fea4ba94-74af-4e37-955e-09d5740e442e",
  "type": "DOM_ELLER_BESLUT",
  "is_precedent": true,
  "court": "Högsta domstolen",
  "court_code": "HDO",
  "keywords": [
    "Enkelt bolag",
    "Likvidation",
    "Uteslutning"
  ],
  "legal_areas": [],
  "legal_references": [
    {
      "reference": "2 kap. 30 § lagen (1980:1102) om handelsbolag och enkla bolag",
      "sfs_number": "1980:1102"
    },
    {
      "reference": "4 kap. 7 § lagen (1980:1102) om handelsbolag och enkla bolag",
      "sfs_number": "1980:1102"
    }
  ],
  "referenced_publications": [],
  "pdf_documents": [
    {
      "filename": "T 2839-24.pdf",
      "file_id": "190/49/f4/49f4b4c7-d194-432c-8da4-29d22dcebb27"
    }
  ],
  "case_url": "https://rattspraxis.etjanst.domstol.se/sok/publicering/8427efc0-5d97-49e3-80af-986e98e275f8",
  "correlation_number": "8427efc0-5d97-49e3-80af-986e98e275f8",
  "full_text": "Sök rättspraxis\nTillbaka\nSkriv ut\nOm avgörandet\nDomstol:\nHögsta domstolen\nMålnummer:\nT 2839-24\nAvgörandedatum:\n2025-04-29\nLagrum\n2 kap. 30 § lagen (1980:1102) om handelsbolag och enkla bolag\n1980:1102\n4 kap. 7 § lagen (1980:1102) om handelsbolag och enkla bolag\n1980:1102\nNyckelord\nEnkelt bolag\nLikvidation\nUteslutning\nT 2839-24\n”Uteslutningen ur bolaget”\nDet är möjligt att utesluta flera bolagsmän samtidigt ur ett enkelt bolag. Kravet på att övriga bolagsmän ska vara ense för att uteslutning ska kunna ske omfattar inte de bolagsmän som begärs uteslutna, under förutsättning att de har en likvidationsgrund hänförlig till sig.\nDom eller beslut\npicture_as_pdf\nT 2839-24.pdf\narrow_forward\nÖppnas i en ny flik\nKontakt\nFrågor och svar\nTillgänglighet\nPrenumerera på RSS-flöde"
}