{
  "case_number": "B 2849-24",
  "nickname": "”Utvisning och anknytning” (I och II) ",
  "summary": "Förutsättningar för utvisning på grund av brott när den dömde har bott i Sverige sedan födseln eller mycket låg ålder.",
  "decision_date": "2025-04-23",
  "publication_time": "2025-04-23T08:45:00",
  "case_id": "32e26f57-f3ea-4692-8ab8-47864b9c3d1e",
  "type": "DOM_ELLER_BESLUT",
  "is_precedent": true,
  "court": "Högsta domstolen",
  "court_code": "HDO",
  "keywords": [
    "Utvisning på grund av brott",
    "Återreseförbud"
  ],
  "legal_areas": [],
  "legal_references": [
    {
      "reference": "8 a kap. 1 § utlänningslagen (2005:716) ",
      "sfs_number": "2005:716"
    },
    {
      "reference": "8 a kap. 2 § utlänningslagen (2005:716) ",
      "sfs_number": "2005:716"
    },
    {
      "reference": "8 a kap. 5 § utlänningslagen (2005:716) ",
      "sfs_number": "2005:716"
    },
    {
      "reference": "8 a kap. 10 § utlänningslagen (2005:716) ",
      "sfs_number": "2005:716"
    },
    {
      "reference": "8 a kap. 11 § utlänningslagen (2005:716) ",
      "sfs_number": "2005:716"
    }
  ],
  "referenced_publications": [
    "”Utlänningens vistelsetid” NJA 2019 s. 316",
    "”Utvisning och familjevåld” NJA 2019 s. 544",
    "Europadomstolens domar Maslov v. Austria [GC], no. 1638/03, ECHR 2008",
    "Savran v. Denmark [GC], no. 57467/15,  7 December 2021"
  ],
  "pdf_documents": [
    {
      "filename": "B 2849-24 I.pdf",
      "file_id": "190/ff/a5/ffa5211c-e6af-467e-94a9-1d08014c0a6d"
    },
    {
      "filename": "B 7807-24 II.pdf",
      "file_id": "190/66/4f/664f1b2e-9ed0-40e6-9446-b0f0f254132d"
    }
  ],
  "case_url": "https://rattspraxis.etjanst.domstol.se/sok/publicering/ce9611d3-277c-4ab4-b1d1-d2d5fc721b4d",
  "correlation_number": "ce9611d3-277c-4ab4-b1d1-d2d5fc721b4d",
  "full_text": "Sök rättspraxis\nTillbaka\nSkriv ut\nOm avgörandet\nDomstol:\nHögsta domstolen\nMålnummer:\nB 2849-24\nB 7807-24\nAvgörandedatum:\n2025-04-23\nEuroparättsligt avgörande:\nJa\nLagrum\n8 a kap. 1 § utlänningslagen (2005:716)\n2005:716\n8 a kap. 2 § utlänningslagen (2005:716)\n2005:716\n8 a kap. 5 § utlänningslagen (2005:716)\n2005:716\n8 a kap. 10 § utlänningslagen (2005:716)\n2005:716\n8 a kap. 11 § utlänningslagen (2005:716)\n2005:716\nHänvisade rättsfall\n”Utlänningens vistelsetid” NJA 2019 s. 316\n”Utvisning och familjevåld” NJA 2019 s. 544\nEuropadomstolens domar Maslov v. Austria [GC], no. 1638/03, ECHR 2008\nSavran v. Denmark [GC], no. 57467/15, 7 December 2021\nNyckelord\nUtvisning på grund av bro...\nÅterreseförbud\nB 2849-24, B 7807-24\n”Utvisning och anknytning” (I och II)\nFörutsättningar för utvisning på grund av brott när den dömde har bott i Sverige sedan födseln eller mycket låg ålder.\nDom eller beslut\npicture_as_pdf\nB 2849-24 I.pdf\narrow_forward\nÖppnas i en ny flik\npicture_as_pdf\nB 7807-24 II.pdf\narrow_forward\nÖppnas i en ny flik\nKontakt\nFrågor och svar\nTillgänglighet\nPrenumerera på RSS-flöde"
}