{
  "case_number": "T 557-24",
  "nickname": "”Skytteholmsbutiken”",
  "summary": "Tillämpning av den s.k. generalklausulen i 12 kap. 57 § första stycket 4 jordabalken.  ",
  "decision_date": "2025-01-29",
  "publication_time": "2025-03-04T15:46:00",
  "case_id": "22833a4b-d6bb-496e-b67c-76b1b3c0f217",
  "type": "DOM_ELLER_BESLUT",
  "is_precedent": false,
  "court": "Högsta domstolen",
  "court_code": "HDO",
  "keywords": [
    "Uppsägning",
    "Generalklausul",
    "Hyresavtal",
    "Hyresförhållande",
    "Lokal",
    "Lokalhyra",
    "Ombyggnad",
    "Rivning"
  ],
  "legal_areas": [],
  "legal_references": [
    {
      "reference": "12 kap. 57 § jordabalken (1970:994)",
      "sfs_number": "1970:994"
    }
  ],
  "referenced_publications": [
    "”Blomsterhandlarens ersättningslokal” NJA 1989 s. 824",
    "”Mercettes hyresavtal” NJA 1991 s. 419",
    "”Fontänen I” NJA 2011 s. 27",
    "”Fontänen II” NJA 2013 s. 1112"
  ],
  "pdf_documents": [
    {
      "filename": "T 557-24.pdf",
      "file_id": "190/17/76/177644a2-ba70-44fb-a79b-22a3857df9b4"
    }
  ],
  "case_url": "https://rattspraxis.etjanst.domstol.se/sok/publicering/9a0ac4d7-b56e-44eb-a6a0-d6d23335b9e1",
  "correlation_number": "9a0ac4d7-b56e-44eb-a6a0-d6d23335b9e1",
  "full_text": "Sök rättspraxis\nTillbaka\nSkriv ut\nOm avgörandet\nDomstol:\nHögsta domstolen\nMålnummer:\nT 557-24\nAvgörandedatum:\n2025-01-29\nLagrum\n12 kap. 57 § jordabalken (1970:994)\n1970:994\nHänvisade rättsfall\n”Blomsterhandlarens ersättningslokal” NJA 1989 s. 824\n”Mercettes hyresavtal” NJA 1991 s. 419\n”Fontänen I” NJA 2011 s. 27\n”Fontänen II” NJA 2013 s. 1112\nNyckelord\nUppsägning\nGeneralklausul\nHyresavtal\nHyresförhållande\nLokal\nLokalhyra\nOmbyggnad\nRivning\nT 557-24\n”Skytteholmsbutiken”\nTillämpning av den s.k. generalklausulen i 12 kap. 57 § första stycket 4 jordabalken.\nDom eller beslut\npicture_as_pdf\nT 557-24.pdf\narrow_forward\nÖppnas i en ny flik\nKontakt\nFrågor och svar\nTillgänglighet\nPrenumerera på RSS-flöde"
}