{
  "case_number": "Ä 1906-24",
  "nickname": "”Den särskilda postadressen”",
  "summary": "Preskriptionsavbrott. När en särskild postadress har registrerats i folkbokföringen är det där som en gäldenär har skäl att bevaka sin post. En borgenär som i ett sådant fall skickar ett kravbrev till gäldenärens folkbokföringsadress kan inte räkna med att brevet kommer gäldenären till handa.  ",
  "decision_date": "2025-01-15",
  "publication_time": "2025-03-04T15:59:00",
  "case_id": "78e73f71-841e-434f-95fa-70be88c89825",
  "type": "DOM_ELLER_BESLUT",
  "is_precedent": true,
  "court": "Högsta domstolen",
  "court_code": "HDO",
  "keywords": [
    "Preskriptionsavbrott",
    "Folkbokföringsadress",
    "Konsumentfordran",
    "Kravbrev",
    "Preskription",
    "Särskild postadress",
    "Verkställighetshinder"
  ],
  "legal_areas": [],
  "legal_references": [
    {
      "reference": "3 kap. 21 § utsökningsbalken (1981:774)",
      "sfs_number": "1981:774"
    },
    {
      "reference": "5 § preskriptionslagen (1981:130)",
      "sfs_number": "1981:130"
    },
    {
      "reference": "25 § folkbokföringslagen (1991:481)",
      "sfs_number": "1991:481"
    }
  ],
  "referenced_publications": [
    "De 25 kravbreven” NJA 2012 s. 172",
    "”Två kravbrev” NJA 2016 s. 332",
    "”Partens egna arbete” NJA 2023 s. 94"
  ],
  "pdf_documents": [
    {
      "filename": "Ä 1906-24.pdf",
      "file_id": "190/2c/68/2c6815c8-70a8-458e-9b76-899ef7c7ddca"
    }
  ],
  "case_url": "https://rattspraxis.etjanst.domstol.se/sok/publicering/1cde5892-45b4-4d36-a53b-15fc5bf99f51",
  "correlation_number": "1cde5892-45b4-4d36-a53b-15fc5bf99f51",
  "full_text": "Sök rättspraxis\nTillbaka\nSkriv ut\nOm avgörandet\nDomstol:\nHögsta domstolen\nMålnummer:\nÄ 1906-24\nAvgörandedatum:\n2025-01-15\nLagrum\n3 kap. 21 § utsökningsbalken (1981:774)\n1981:774\n5 § preskriptionslagen (1981:130)\n1981:130\n25 § folkbokföringslagen (1991:481)\n1991:481\nHänvisade rättsfall\nDe 25 kravbreven” NJA 2012 s. 172\n”Två kravbrev” NJA 2016 s. 332\n”Partens egna arbete” NJA 2023 s. 94\nNyckelord\nPreskriptionsavbrott\nFolkbokföringsadress\nKonsumentfordran\nKravbrev\nPreskription\nSärskild postadress\nVerkställighetshinder\nÄ 1906-24\n”Den särskilda postadressen”\nPreskriptionsavbrott. När en särskild postadress har registrerats i folkbokföringen är det där som en gäldenär har skäl att bevaka sin post. En borgenär som i ett sådant fall skickar ett kravbrev till gäldenärens folkbokföringsadress kan inte räkna med att brevet kommer gäldenären till handa.\nDom eller beslut\npicture_as_pdf\nÄ 1906-24.pdf\narrow_forward\nÖppnas i en ny flik\nKontakt\nFrågor och svar\nTillgänglighet\nPrenumerera på RSS-flöde"
}