{
  "case_number": "T 1101-24",
  "nickname": "”Det oriktiga förvaltarskapet”",
  "summary": "Bestämmande av ideellt skadestånd enligt 5 kap. 8 § skadeståndslagen vid överträdelse av Europakonventionen. ",
  "decision_date": "2025-04-25",
  "publication_time": "2025-04-30T11:50:00",
  "case_id": "c06318c1-ca9b-4cf7-87ba-729c3814a167",
  "type": "DOM_ELLER_BESLUT",
  "is_precedent": true,
  "court": "Högsta domstolen",
  "court_code": "HDO",
  "keywords": [
    "Skadestånd",
    "Europakonventionen",
    "Grundlagsskadestånd",
    "Ideell skada",
    "Konventionsskadestånd",
    "Kränkning",
    "Rättighetsöverträdelse"
  ],
  "legal_areas": [],
  "legal_references": [
    {
      "reference": "3 kap. 4 § skadeståndslagen (1972:207)",
      "sfs_number": "1972:207"
    },
    {
      "reference": "5 kap. 8 § skadeståndslagen (1972:207)",
      "sfs_number": "1972:207"
    }
  ],
  "referenced_publications": [
    "”Finanschefen på ICS” NJA 2005 s. 462",
    "”Den långa häktningstiden” NJA 2007 s. 295",
    "”Den felaktiga läkarundersökningen” NJA 2007 s. 584",
    "”Medborgarskapet I” NJA 2014 s. 323",
    "”Medborgarskapet II” NJA 2018 s. 103",
    "”Det oönskade förvaltarskapet”  NJA 2018 s. 350",
    "Ivinović v. Croatia, no. 13006/13, 18 September 2014",
    "Nikolyan v. Armenia, no. 74438/14, 3 October 2019",
    "N. v. Romania (No. 2), no. 38048/18, 16 November 2021"
  ],
  "pdf_documents": [
    {
      "filename": "T 1101-24.pdf",
      "file_id": "190/a4/ae/a4ae3d81-4839-427b-ad2c-46d8d47fc2fb"
    }
  ],
  "case_url": "https://rattspraxis.etjanst.domstol.se/sok/publicering/749faa7d-9fbb-4b09-a0d5-ef0f739d91aa",
  "correlation_number": "749faa7d-9fbb-4b09-a0d5-ef0f739d91aa",
  "full_text": "Sök rättspraxis\nTillbaka\nSkriv ut\nOm avgörandet\nDomstol:\nHögsta domstolen\nMålnummer:\nT 1101-24\nAvgörandedatum:\n2025-04-25\nEuroparättsligt avgörande:\nJa\nLagrum\n3 kap. 4 § skadeståndslagen (1972:207)\n1972:207\n5 kap. 8 § skadeståndslagen (1972:207)\n1972:207\nHänvisade rättsfall\n”Finanschefen på ICS” NJA 2005 s. 462\n”Den långa häktningstiden” NJA 2007 s. 295\n”Den felaktiga läkarundersökningen” NJA 2007 s. 584\n”Medborgarskapet I” NJA 2014 s. 323\n”Medborgarskapet II” NJA 2018 s. 103\n”Det oönskade förvaltarskapet” NJA 2018 s. 350\nIvinović v. Croatia, no. 13006/13, 18 September 2014\nNikolyan v. Armenia, no. 74438/14, 3 October 2019\nN. v. Romania (No. 2), no. 38048/18, 16 November 2021\nNyckelord\nSkadestånd\nEuropakonventionen\nGrundlagsskadestånd\nIdeell skada\nKonventionsskadestånd\nKränkning\nRättighetsöverträdelse\nT 1101-24\n”Det oriktiga förvaltarskapet”\nBestämmande av ideellt skadestånd enligt 5 kap. 8 § skadeståndslagen vid överträdelse av Europakonventionen.\nDom eller beslut\npicture_as_pdf\nT 1101-24.pdf\narrow_forward\nÖppnas i en ny flik\nKontakt\nFrågor och svar\nTillgänglighet\nPrenumerera på RSS-flöde"
}