{
  "case_number": "Ä 5465-24",
  "nickname": "\"Avhoppet\"",
  "summary": "Tillämpning av lagen om fingerade personuppgifter. Omständigheter som medför att det inte är tillräckligt med skyddad folkbokföring för att tillgodose skyddsbehovet samt innebörden av kravet på att fingerade personuppgifter ska kunna antas tillgodose behovet av skydd.",
  "decision_date": "2025-03-20",
  "publication_time": "2025-03-20T08:45:00",
  "case_id": "0d976d1f-745a-48af-98aa-c09cd38c9632",
  "type": "DOM_ELLER_BESLUT",
  "is_precedent": true,
  "court": "Högsta domstolen",
  "court_code": "HDO",
  "keywords": [
    "Fingerade personuppgifter",
    "Identitetsbyte",
    "Skyddad folkbokföring"
  ],
  "legal_areas": [],
  "legal_references": [
    {
      "reference": "1 § lagen (1991:483) om fingerade personuppgifter",
      "sfs_number": "1991:438"
    },
    {
      "reference": "16 § folkbokföringslagen (1991:481)",
      "sfs_number": "1991:481"
    }
  ],
  "referenced_publications": [
    "”Ansökan om identitetsbyte I och II” NJA 1994 s. 497 I och II"
  ],
  "pdf_documents": [
    {
      "filename": "Ä 5465-24.pdf",
      "file_id": "190/18/3a/183ab54f-6d09-4e6c-8191-34ad6a9cd80f"
    }
  ],
  "case_url": "https://rattspraxis.etjanst.domstol.se/sok/publicering/a71076cd-beb9-46a4-8880-1cea01bc5e17",
  "correlation_number": "a71076cd-beb9-46a4-8880-1cea01bc5e17",
  "full_text": "Sök rättspraxis\nTillbaka\nSkriv ut\nOm avgörandet\nDomstol:\nHögsta domstolen\nMålnummer:\nÄ 5465-24\nAvgörandedatum:\n2025-03-20\nLagrum\n1 § lagen (1991:483) om fingerade personuppgifter\n1991:438\n16 § folkbokföringslagen (1991:481)\n1991:481\nHänvisade rättsfall\n”Ansökan om identitetsbyte I och II” NJA 1994 s. 497 I och II\nNyckelord\nFingerade personuppgifter...\nIdentitetsbyte\nSkyddad folkbokföring\nÄ 5465-24\n\"Avhoppet\"\nTillämpning av lagen om fingerade personuppgifter. Omständigheter som medför att det inte är tillräckligt med skyddad folkbokföring för att tillgodose skyddsbehovet samt innebörden av kravet på att fingerade personuppgifter ska kunna antas tillgodose behovet av skydd.\nDom eller beslut\npicture_as_pdf\nÄ 5465-24.pdf\narrow_forward\nÖppnas i en ny flik\nKontakt\nFrågor och svar\nTillgänglighet\nPrenumerera på RSS-flöde"
}