{
  "case_number": "B 4573-24",
  "nickname": "”Drograttfylleriet i Fyledalen”",
  "summary": "Grovt brott vid drograttfylleri? Även fråga om påföljdsval för en ung lagöverträdare vid förbättring av de personliga och sociala förhållandena. ",
  "decision_date": "2025-03-19",
  "publication_time": "2025-03-19T08:45:00",
  "case_id": "ced0c8da-894a-4309-9bd0-3ade214d2400",
  "type": "DOM_ELLER_BESLUT",
  "is_precedent": true,
  "court": "Högsta domstolen",
  "court_code": "HDO",
  "keywords": [
    "Grovt rattfylleri",
    "Brottspåföljd",
    "Drograttfylleri",
    "Reformatio in pejus",
    "Samhällstjänst",
    "Ungdom"
  ],
  "legal_areas": [],
  "legal_references": [
    {
      "reference": "29 kap. 7 § brottsbalken (1962:700)",
      "sfs_number": "1962:700"
    },
    {
      "reference": "30 kap. 3 § brottsbalken (1962:700)",
      "sfs_number": "1962:700"
    },
    {
      "reference": "51 kap. 25 § rättegångsbalken (1942:740)",
      "sfs_number": "1942:740"
    },
    {
      "reference": "4 § lag (1951:649) om straff för vissa trafikbrott",
      "sfs_number": "1951:649"
    },
    {
      "reference": "4 a § lag (1951:649) om straff för vissa trafikbrott",
      "sfs_number": "1951:649"
    }
  ],
  "referenced_publications": [
    "”Körningen i Kisa” NJA 1994 s. 102",
    "”Socialkontorsfallet” NJA 2000 s. 314",
    "”Körningen på parkeringsplatsen” NJA 2003 s. 67",
    "”Slaget med bokryggen” NJA 2015 s. 386",
    "\"Mopedbilen\" NJA 2019 s. 684",
    "”Den positiva utvecklingen” NJA 2023 s. 1118"
  ],
  "pdf_documents": [
    {
      "filename": "B 4573-24.pdf",
      "file_id": "190/20/35/20355277-7a56-4a7d-9fae-e3ce8dd00ba2"
    }
  ],
  "case_url": "https://rattspraxis.etjanst.domstol.se/sok/publicering/abbcbf1c-8d7a-4264-b9ba-4cb7c494e76f",
  "correlation_number": "abbcbf1c-8d7a-4264-b9ba-4cb7c494e76f",
  "full_text": "Sök rättspraxis\nTillbaka\nSkriv ut\nOm avgörandet\nDomstol:\nHögsta domstolen\nMålnummer:\nB 4573-24\nAvgörandedatum:\n2025-03-19\nLagrum\n29 kap. 7 § brottsbalken (1962:700)\n1962:700\n30 kap. 3 § brottsbalken (1962:700)\n1962:700\n51 kap. 25 § rättegångsbalken (1942:740)\n1942:740\n4 § lag (1951:649) om straff för vissa trafikbrott\n1951:649\n4 a § lag (1951:649) om straff för vissa trafikbrott\n1951:649\nHänvisade rättsfall\n”Körningen i Kisa” NJA 1994 s. 102\n”Socialkontorsfallet” NJA 2000 s. 314\n”Körningen på parkeringsplatsen” NJA 2003 s. 67\n”Slaget med bokryggen” NJA 2015 s. 386\n\"Mopedbilen\" NJA 2019 s. 684\n”Den positiva utvecklingen” NJA 2023 s. 1118\nNyckelord\nGrovt rattfylleri\nBrottspåföljd\nDrograttfylleri\nReformatio in pejus\nSamhällstjänst\nUngdom\nB 4573-24\n”Drograttfylleriet i Fyledalen”\nGrovt brott vid drograttfylleri? Även fråga om påföljdsval för en ung lagöverträdare vid förbättring av de personliga och sociala förhållandena.\nDom eller beslut\npicture_as_pdf\nB 4573-24.pdf\narrow_forward\nÖppnas i en ny flik\nKontakt\nFrågor och svar\nTillgänglighet\nPrenumerera på RSS-flöde"
}