{
  "case_number": "ÖP 4479-23",
  "nickname": "\"Detaljplanen i Borgholm\"",
  "summary": "Den hänsyn som ska tas till skyddet av jordbruksmark vid beslut om detaljplan har bedömts aktualisera bestämmelser som är relaterade till miljön och naturskyddet. En förening som har till huvudsakligt ändamål att skydda jordbruksmark från exploatering har därför ansetts berörd av ett beslut om en detaljplan på ett sådant sätt att den haft rätt att överklaga beslutet.",
  "decision_date": "2025-04-08",
  "publication_time": "2025-04-08T08:45:00",
  "case_id": "9860e0f0-b4ec-4643-a964-f48a7a5c2352",
  "type": "DOM_ELLER_BESLUT",
  "is_precedent": true,
  "court": "Högsta domstolen",
  "court_code": "HDO",
  "keywords": [
    "Klagorätt",
    "Detaljplanebeslut",
    "Jordbruksmark",
    "Mijöorganisationer",
    "Århuskonventionen"
  ],
  "legal_areas": [],
  "legal_references": [
    {
      "reference": "2 kap. 2 § plan- och bygglagen (2010:900)",
      "sfs_number": "2010:900"
    },
    {
      "reference": "13 kap. 8 § plan- och bygglagen (2010:900)",
      "sfs_number": "2010:900"
    },
    {
      "reference": "42 § förvaltningslagen (2017:900)",
      "sfs_number": "2017:900"
    }
  ],
  "referenced_publications": [
    "”Bygglovet i Svartrå” NJA 2020 s. 190",
    "”Snäckan 8” NJA 2020 s. 641 ",
    "”Liljeholmsbadet” NJA 2023 s. 883"
  ],
  "pdf_documents": [
    {
      "filename": "ÖP 4479-23.pdf",
      "file_id": "190/3e/6b/3e6beffa-de65-4e35-8a30-56bc84ea9f61"
    }
  ],
  "case_url": "https://rattspraxis.etjanst.domstol.se/sok/publicering/7425505b-0859-45db-a8fd-dbb7b4f71a94",
  "correlation_number": "7425505b-0859-45db-a8fd-dbb7b4f71a94",
  "full_text": "Sök rättspraxis\nTillbaka\nSkriv ut\nOm avgörandet\nDomstol:\nHögsta domstolen\nMålnummer:\nÖP 4479-23\nAvgörandedatum:\n2025-04-08\nEuroparättsligt avgörande:\nJa\nLagrum\n2 kap. 2 § plan- och bygglagen (2010:900)\n2010:900\n13 kap. 8 § plan- och bygglagen (2010:900)\n2010:900\n42 § förvaltningslagen (2017:900)\n2017:900\nHänvisade rättsfall\n”Bygglovet i Svartrå” NJA 2020 s. 190\n”Snäckan 8” NJA 2020 s. 641\n”Liljeholmsbadet” NJA 2023 s. 883\nNyckelord\nKlagorätt\nDetaljplanebeslut\nJordbruksmark\nMijöorganisationer\nÅrhuskonventionen\nÖP 4479-23\n\"Detaljplanen i Borgholm\"\nDen hänsyn som ska tas till skyddet av jordbruksmark vid beslut om detaljplan har bedömts aktualisera bestämmelser som är relaterade till miljön och naturskyddet. En förening som har till huvudsakligt ändamål att skydda jordbruksmark från exploatering har därför ansetts berörd av ett beslut om en detaljplan på ett sådant sätt att den haft rätt att överklaga beslutet.\nDom eller beslut\npicture_as_pdf\nÖP 4479-23.pdf\narrow_forward\nÖppnas i en ny flik\nKontakt\nFrågor och svar\nTillgänglighet\nPrenumerera på RSS-flöde"
}