{
  "case_number": "T 7843-23",
  "nickname": "”Bostadsrätten i Saltsjö-Boo”",
  "summary": "Rätten att avhjälpa fel i en lägenhet som ska tillträdas första gången efter en bostadsrättsupplåtelse. Om bostadsrättsföreningen inte avhjälper felet har bostadsrättshavaren rätt till ersättning för försvarliga kostnader som bostadsrättshavaren kommer att ha för att göra detta.",
  "decision_date": "2025-04-25",
  "publication_time": "2025-04-25T08:45:00",
  "case_id": "24da2ddc-f1be-43ae-8b77-6d02b1a5f798",
  "type": "DOM_ELLER_BESLUT",
  "is_precedent": true,
  "court": "Högsta domstolen",
  "court_code": "HDO",
  "keywords": [
    "Bostadsrätt",
    "Avhjälpande",
    "Avhjälpandekostnad",
    "Bostadsupplåtelse",
    "Ersättning",
    "Fel",
    "Nyproduktion",
    "Tillträde",
    "Upplåtelse"
  ],
  "legal_areas": [],
  "legal_references": [
    {
      "reference": "7 kap. 2 § bostadsrättslagen (1991:614)",
      "sfs_number": "1991:614"
    }
  ],
  "referenced_publications": [],
  "pdf_documents": [
    {
      "filename": "T 7843-23.pdf",
      "file_id": "190/8a/ed/8aede036-776c-4770-ab25-2ec3f22249ec"
    }
  ],
  "case_url": "https://rattspraxis.etjanst.domstol.se/sok/publicering/b011ca45-fc53-4233-99b4-5eb4d9831377",
  "correlation_number": "b011ca45-fc53-4233-99b4-5eb4d9831377",
  "full_text": "Sök rättspraxis\nTillbaka\nSkriv ut\nOm avgörandet\nDomstol:\nHögsta domstolen\nMålnummer:\nT 7843-23\nAvgörandedatum:\n2025-04-25\nLagrum\n7 kap. 2 § bostadsrättslagen (1991:614)\n1991:614\nNyckelord\nBostadsrätt\nAvhjälpande\nAvhjälpandekostnad\nBostadsupplåtelse\nErsättning\nFel\nNyproduktion\nTillträde\nUpplåtelse\nT 7843-23\n”Bostadsrätten i Saltsjö-Boo”\nRätten att avhjälpa fel i en lägenhet som ska tillträdas första gången efter en bostadsrättsupplåtelse. Om bostadsrättsföreningen inte avhjälper felet har bostadsrättshavaren rätt till ersättning för försvarliga kostnader som bostadsrättshavaren kommer att ha för att göra detta.\nDom eller beslut\npicture_as_pdf\nT 7843-23.pdf\narrow_forward\nÖppnas i en ny flik\nKontakt\nFrågor och svar\nTillgänglighet\nPrenumerera på RSS-flöde"
}