{
  "case_number": "Ö 2261-24",
  "nickname": "”Överklagande för säkerhets skull II”",
  "summary": "En offentlig försvarare som har haft fog att räkna med att den tilltalade önskade överklaga har rätt till skälig ersättning för arbete med ett överklagande utan uppdrag. Att försvararen och den tilltalade var närvarande när domen avkunnades påverkar inte i sig bedömningen av om försvararen hade fog för att överklaga.",
  "decision_date": "2025-04-11",
  "publication_time": "2025-05-21T14:15:00",
  "case_id": "862df510-f750-4a2d-8870-88c1178f3611",
  "type": "DOM_ELLER_BESLUT",
  "is_precedent": true,
  "court": "Högsta domstolen",
  "court_code": "HDO",
  "keywords": [
    "Offentlig försvarare",
    "Skälig ersättning",
    "Uppdrag",
    "Överklagande"
  ],
  "legal_areas": [],
  "legal_references": [
    {
      "reference": "21 kap. 10 § rättegångsbalken (1942:740)",
      "sfs_number": "1942:740"
    }
  ],
  "referenced_publications": [
    "NJA 1973 s. 385",
    "NJA 1979 s. 251",
    "NJA 1980 s. 587",
    "”Överklagande för säkerhets skull I” NJA 2022 s. 757"
  ],
  "pdf_documents": [
    {
      "filename": "Ö 2261-24.pdf",
      "file_id": "190/fe/39/fe39d3e2-7136-4ac2-9349-59754cae350e"
    }
  ],
  "case_url": "https://rattspraxis.etjanst.domstol.se/sok/publicering/7498716b-83ff-4c8c-8740-51bbc654e3a8",
  "correlation_number": "7498716b-83ff-4c8c-8740-51bbc654e3a8",
  "full_text": "Sök rättspraxis\nTillbaka\nSkriv ut\nOm avgörandet\nDomstol:\nHögsta domstolen\nMålnummer:\nÖ 2261-24\nAvgörandedatum:\n2025-04-11\nLagrum\n21 kap. 10 § rättegångsbalken (1942:740)\n1942:740\nHänvisade rättsfall\nNJA 1973 s. 385\nNJA 1979 s. 251\nNJA 1980 s. 587\n”Överklagande för säkerhets skull I” NJA 2022 s. 757\nNyckelord\nOffentlig försvarare\nSkälig ersättning\nUppdrag\nÖverklagande\nÖ 2261-24\n”Överklagande för säkerhets skull II”\nEn offentlig försvarare som har haft fog att räkna med att den tilltalade önskade överklaga har rätt till skälig ersättning för arbete med ett överklagande utan uppdrag. Att försvararen och den tilltalade var närvarande när domen avkunnades påverkar inte i sig bedömningen av om försvararen hade fog för att överklaga.\nDom eller beslut\npicture_as_pdf\nÖ 2261-24.pdf\narrow_forward\nÖppnas i en ny flik\nKontakt\nFrågor och svar\nTillgänglighet\nPrenumerera på RSS-flöde"
}