{
  "case_number": "T 262-24",
  "nickname": "”Esterands arvodesbetalning”",
  "summary": "Återvinning i konkurs. Betydelsen vid återvinning av arvode, som bedömts som uppenbart oskäligt, av att den företagsrekonstruktör som kravet riktas mot har varit anställd och haft ägarintressen i ett bolag och att arvodet har överförts direkt till det bolaget.",
  "decision_date": "2025-06-17",
  "publication_time": "2025-06-17T08:45:00",
  "case_id": "921ca554-4386-442b-a535-d78489e2907f",
  "type": "DOM_ELLER_BESLUT",
  "is_precedent": true,
  "court": "Högsta domstolen",
  "court_code": "HDO",
  "keywords": [
    "Återvinning i konkurs",
    "Betalningsanvisning",
    "Företagsrekonstruktion",
    "Oskäligt arvode",
    "Rekonstruktörsarvode"
  ],
  "legal_areas": [],
  "legal_references": [
    {
      "reference": "4 kap. 8 § konkurslagen (1987:672)",
      "sfs_number": "1987:672"
    }
  ],
  "referenced_publications": [
    "”Konkursen i Kisa” NJA 1973 s. 42",
    "”Den amerikanska medborgarens testamente” NJA 2000 s. 639",
    "”Advokataktiebolaget och konkursförvaltararvodet” NJA 2001 s. 872",
    "”Gulliver” NJA 2007 s. 599",
    "”Frölunda Café” NJA 2024  s. 150"
  ],
  "pdf_documents": [
    {
      "filename": "T 262-24.pdf",
      "file_id": "190/9d/a8/9da82775-2c61-4c59-84c7-35acf0f0a6f1"
    }
  ],
  "case_url": "https://rattspraxis.etjanst.domstol.se/sok/publicering/616fbdee-0032-4ed7-8e11-fc4034425c09",
  "correlation_number": "616fbdee-0032-4ed7-8e11-fc4034425c09",
  "full_text": "Sök rättspraxis\nTillbaka\nSkriv ut\nOm avgörandet\nDomstol:\nHögsta domstolen\nMålnummer:\nT 262-24\nAvgörandedatum:\n2025-06-17\nLagrum\n4 kap. 8 § konkurslagen (1987:672)\n1987:672\nHänvisade rättsfall\n”Konkursen i Kisa” NJA 1973 s. 42\n”Den amerikanska medborgarens testamente” NJA 2000 s. 639\n”Advokataktiebolaget och konkursförvaltararvodet” NJA 2001 s. 872\n”Gulliver” NJA 2007 s. 599\n”Frölunda Café” NJA 2024 s. 150\nNyckelord\nÅtervinning i konkurs\nBetalningsanvisning\nFöretagsrekonstruktion\nOskäligt arvode\nRekonstruktörsarvode\nT 262-24\n”Esterands arvodesbetalning”\nÅtervinning i konkurs. Betydelsen vid återvinning av arvode, som bedömts som uppenbart oskäligt, av att den företagsrekonstruktör som kravet riktas mot har varit anställd och haft ägarintressen i ett bolag och att arvodet har överförts direkt till det bolaget.\nDom eller beslut\npicture_as_pdf\nT 262-24.pdf\narrow_forward\nÖppnas i en ny flik\nKontakt\nFrågor och svar\nTillgänglighet\nPrenumerera på RSS-flöde"
}