{
  "case_number": "T 3706-23",
  "nickname": "”Smyrna”",
  "summary": "Bestämmande av tomträttsavgäld för bostadsrättsförening.",
  "decision_date": "2025-04-24",
  "publication_time": "2025-04-24T08:45:00",
  "case_id": "444a9308-1e5c-418d-b1ba-e9c722a62279",
  "type": "DOM_ELLER_BESLUT",
  "is_precedent": true,
  "court": "Högsta domstolen",
  "court_code": "HDO",
  "keywords": [
    "Tomträttsavgäld",
    "Avgäld",
    "Avgäldsränta",
    "Bostadsrättsförening",
    "Bostadsändamål",
    "Realränta",
    "Tomträtt"
  ],
  "legal_areas": [],
  "legal_references": [
    {
      "reference": "13 kap. 11 § jordabalken (1970:994)",
      "sfs_number": "1970:994"
    }
  ],
  "referenced_publications": [
    "”Beridarebanan” NJA 1986 s. 272",
    "”Muskotnöten” NJA 1988 s. 343",
    "”Lundafastigheterna” NJA 1990 s. 714"
  ],
  "pdf_documents": [
    {
      "filename": "T 3706-23.pdf",
      "file_id": "190/db/5a/db5a2e9f-bf5f-49a4-8a4e-58d5c66db24f"
    }
  ],
  "case_url": "https://rattspraxis.etjanst.domstol.se/sok/publicering/5e7aca3d-e6b5-4895-803d-4540dade4628",
  "correlation_number": "5e7aca3d-e6b5-4895-803d-4540dade4628",
  "full_text": "Sök rättspraxis\nTillbaka\nSkriv ut\nOm avgörandet\nDomstol:\nHögsta domstolen\nMålnummer:\nT 3706-23\nAvgörandedatum:\n2025-04-24\nLagrum\n13 kap. 11 § jordabalken (1970:994)\n1970:994\nHänvisade rättsfall\n”Beridarebanan” NJA 1986 s. 272\n”Muskotnöten” NJA 1988 s. 343\n”Lundafastigheterna” NJA 1990 s. 714\nNyckelord\nTomträttsavgäld\nAvgäld\nAvgäldsränta\nBostadsrättsförening\nBostadsändamål\nRealränta\nTomträtt\nT 3706-23\n”Smyrna”\nBestämmande av tomträttsavgäld för bostadsrättsförening.\nDom eller beslut\npicture_as_pdf\nT 3706-23.pdf\narrow_forward\nÖppnas i en ny flik\nKontakt\nFrågor och svar\nTillgänglighet\nPrenumerera på RSS-flöde"
}