{
  "case_number": "T 3017-24",
  "nickname": "”Pontonbryggan”",
  "summary": "Ett bolag har insett att den som beställt en tjänst har gjort det i annans namn. Fråga om hur synligt det måste vara för bolaget vem som är huvudman för att huvudmannen ska anses vara beställare.",
  "decision_date": "2025-06-05",
  "publication_time": "2025-06-05T08:45:00",
  "case_id": "f6a28a5a-769b-4353-b024-9b1b67fe051d",
  "type": "DOM_ELLER_BESLUT",
  "is_precedent": true,
  "court": "Högsta domstolen",
  "court_code": "HDO",
  "keywords": [
    "Avtal",
    "Fullmakt",
    "Tjänst"
  ],
  "legal_areas": [],
  "legal_references": [
    {
      "reference": "10 § avtalslagen (1915:218)",
      "sfs_number": "1915:218"
    }
  ],
  "referenced_publications": [
    "”Badbolagets beställning” NJA 1914 s. 318",
    "”Kemisk-tekniska bolagets kartonger” NJA 1927 s. 573",
    "”OneTicketAway” NJA 2014 s. 978"
  ],
  "pdf_documents": [
    {
      "filename": "T 3017-24.pdf",
      "file_id": "190/e8/13/e8134e83-e0f0-440e-8e32-1f00b2401c96"
    }
  ],
  "case_url": "https://rattspraxis.etjanst.domstol.se/sok/publicering/fc86421f-31cd-4705-8013-c2a655e5f2b1",
  "correlation_number": "fc86421f-31cd-4705-8013-c2a655e5f2b1",
  "full_text": "Sök rättspraxis\nTillbaka\nSkriv ut\nOm avgörandet\nDomstol:\nHögsta domstolen\nMålnummer:\nT 3017-24\nAvgörandedatum:\n2025-06-05\nLagrum\n10 § avtalslagen (1915:218)\n1915:218\nHänvisade rättsfall\n”Badbolagets beställning” NJA 1914 s. 318\n”Kemisk-tekniska bolagets kartonger” NJA 1927 s. 573\n”OneTicketAway” NJA 2014 s. 978\nNyckelord\nAvtal\nFullmakt\nTjänst\nT 3017-24\n”Pontonbryggan”\nEtt bolag har insett att den som beställt en tjänst har gjort det i annans namn. Fråga om hur synligt det måste vara för bolaget vem som är huvudman för att huvudmannen ska anses vara beställare.\nDom eller beslut\npicture_as_pdf\nT 3017-24.pdf\narrow_forward\nÖppnas i en ny flik\nKontakt\nFrågor och svar\nTillgänglighet\nPrenumerera på RSS-flöde"
}