{
  "case_number": "Ö 374-24",
  "nickname": "\"De neutrala dödsbodelägarna\"",
  "summary": "Förutsättningar för en dödsbodelägare att med stöd av 19 kap. 12 a § ärvdabalken väcka och föra talan i eget namn men för dödsboets räkning.\nSamma dag avgjordes på motsvarande sätt mål Ö 376-24.  ",
  "decision_date": "2025-01-22",
  "publication_time": "2025-03-04T16:07:00",
  "case_id": "76bfa787-bcf9-4323-a525-d8094d110f13",
  "type": "DOM_ELLER_BESLUT",
  "is_precedent": true,
  "court": "Högsta domstolen",
  "court_code": "HDO",
  "keywords": [
    "Talerätt",
    "Dödsbo",
    "Dödsbodelägare"
  ],
  "legal_areas": [],
  "legal_references": [
    {
      "reference": "19 kap. 12 a § ärvdabalken (1958:637)",
      "sfs_number": "1958:637"
    },
    {
      "reference": "19 kap. 20 a § ärvdabalken (1958:637)",
      "sfs_number": "1958:637"
    },
    {
      "reference": "18 kap. 1 b § ärvdabalken (1958:637)",
      "sfs_number": "1958:637"
    }
  ],
  "referenced_publications": [
    "Fastigheten Ren” NJA 1969 s. 437",
    "”Stadsägan i Solumshamn” NJA 1972 s. 586",
    "”Fastighetsföreningen Ekhöjden” NJA 1974 s. 623",
    "”Kvarteret Selleriet” NJA 1976 s. 615",
    "”Fastigheterna i Heda” NJA 1979 s. 169",
    "”Den tredje delägaren” NJA 2007 s. 69"
  ],
  "pdf_documents": [
    {
      "filename": "Ö 374-24.pdf",
      "file_id": "190/34/04/34048eb8-342a-4827-b5f2-c1d9b483a8d5"
    }
  ],
  "case_url": "https://rattspraxis.etjanst.domstol.se/sok/publicering/667f15e5-2edf-44a0-98df-6dadeeaeda7e",
  "correlation_number": "667f15e5-2edf-44a0-98df-6dadeeaeda7e",
  "full_text": "Sök rättspraxis\nTillbaka\nSkriv ut\nOm avgörandet\nDomstol:\nHögsta domstolen\nMålnummer:\nÖ 374-24\nAvgörandedatum:\n2025-01-22\nLagrum\n19 kap. 12 a § ärvdabalken (1958:637)\n1958:637\n19 kap. 20 a § ärvdabalken (1958:637)\n1958:637\n18 kap. 1 b § ärvdabalken (1958:637)\n1958:637\nHänvisade rättsfall\nFastigheten Ren” NJA 1969 s. 437\n”Stadsägan i Solumshamn” NJA 1972 s. 586\n”Fastighetsföreningen Ekhöjden” NJA 1974 s. 623\n”Kvarteret Selleriet” NJA 1976 s. 615\n”Fastigheterna i Heda” NJA 1979 s. 169\n”Den tredje delägaren” NJA 2007 s. 69\nNyckelord\nTalerätt\nDödsbo\nDödsbodelägare\nÖ 374-24\n\"De neutrala dödsbodelägarna\"\nFörutsättningar för en dödsbodelägare att med stöd av 19 kap. 12 a § ärvdabalken väcka och föra talan i eget namn men för dödsboets räkning. Samma dag avgjordes på motsvarande sätt mål Ö 376-24.\nDom eller beslut\npicture_as_pdf\nÖ 374-24.pdf\narrow_forward\nÖppnas i en ny flik\nKontakt\nFrågor och svar\nTillgänglighet\nPrenumerera på RSS-flöde"
}