{
  "case_number": "T 8723-23",
  "nickname": "”CashCom”",
  "summary": "Bestämmelserna i 25 kap. 18 § första stycket aktiebolagslagen om personligt betalningsansvar för styrelseledamöter kan tillämpas även på den som i realiteten utövar ett bestämmande inflytande i ett bolag (faktisk företrädare).",
  "decision_date": "2025-05-15",
  "publication_time": "2025-05-15T08:45:00",
  "case_id": "a140b47f-db6d-4cab-9746-c620d64ec0f6",
  "type": "DOM_ELLER_BESLUT",
  "is_precedent": true,
  "court": "Högsta domstolen",
  "court_code": "HDO",
  "keywords": [
    "Personligt betalningsansvar",
    "Aktiebolag",
    "Analogisk tillämpning",
    "Faktisk företrädare",
    "Medansvar",
    "Styrelseledamot"
  ],
  "legal_areas": [],
  "legal_references": [
    {
      "reference": "25 kap. 18 § aktiebolagslagen (2005:551)",
      "sfs_number": "2005:551"
    }
  ],
  "referenced_publications": [
    "”Fastighetsföreningen Ampeln” NJA 1948 s. 651",
    "”Styrelsesuppleanten” NJA 1985 s. 439",
    "”Prokuristens ansvar” NJA 1993 s. 740",
    "”SÖMÅ AB” NJA 1997 s. 418",
    "”Processbolaget” NJA 2014 s. 877",
    "”PI Finans” NJA 2014 s. 892",
    "”Kompanjonens ansvar” NJA 2017 s. 690",
    "”Medansvar för rättegångskostnader” NJA 2020 s. 526"
  ],
  "pdf_documents": [
    {
      "filename": "T 8723-23.pdf",
      "file_id": "190/b1/f2/b1f291f6-2b0a-4508-913a-3a116b50a67f"
    }
  ],
  "case_url": "https://rattspraxis.etjanst.domstol.se/sok/publicering/65fd33a7-30b3-4155-8b6b-bca1ef96663b",
  "correlation_number": "65fd33a7-30b3-4155-8b6b-bca1ef96663b",
  "full_text": "Sök rättspraxis\nTillbaka\nSkriv ut\nOm avgörandet\nDomstol:\nHögsta domstolen\nMålnummer:\nT 8723-23\nAvgörandedatum:\n2025-05-15\nLagrum\n25 kap. 18 § aktiebolagslagen (2005:551)\n2005:551\nHänvisade rättsfall\n”Fastighetsföreningen Ampeln” NJA 1948 s. 651\n”Styrelsesuppleanten” NJA 1985 s. 439\n”Prokuristens ansvar” NJA 1993 s. 740\n”SÖMÅ AB” NJA 1997 s. 418\n”Processbolaget” NJA 2014 s. 877\n”PI Finans” NJA 2014 s. 892\n”Kompanjonens ansvar” NJA 2017 s. 690\n”Medansvar för rättegångskostnader” NJA 2020 s. 526\nNyckelord\nPersonligt betalningsansv...\nAktiebolag\nAnalogisk tillämpning\nFaktisk företrädare\nMedansvar\nStyrelseledamot\nT 8723-23\n”CashCom”\nBestämmelserna i 25 kap. 18 § första stycket aktiebolagslagen om personligt betalningsansvar för styrelseledamöter kan tillämpas även på den som i realiteten utövar ett bestämmande inflytande i ett bolag (faktisk företrädare).\nDom eller beslut\npicture_as_pdf\nT 8723-23.pdf\narrow_forward\nÖppnas i en ny flik\nKontakt\nFrågor och svar\nTillgänglighet\nPrenumerera på RSS-flöde"
}