{
  "case_number": "T 4262-24",
  "nickname": "”Brynge kraftverk”",
  "summary": "Allmän domstol, och inte mark- och miljödomstol, har ansetts behörig att pröva en fastställelsetalan om innebörden av ett villkor om rätt till fri elektrisk kraft i ett utslag av vattendomstol.",
  "decision_date": "2025-06-25",
  "publication_time": "2025-06-25T08:45:00",
  "case_id": "f15beb4a-cb9c-4109-91b3-497ed545f3a2",
  "type": "DOM_ELLER_BESLUT",
  "is_precedent": true,
  "court": "Högsta domstolen",
  "court_code": "HDO",
  "keywords": [
    "Allmän domstols behörighet",
    "Andelskraft",
    "Ersättningskraft",
    "Fastställelsetalan",
    "Frikraft",
    "Mark- och miljödomstol",
    "Vattenmål"
  ],
  "legal_areas": [],
  "legal_references": [
    {
      "reference": "10 kap. 17 § rättegångsbalken (1942:740)",
      "sfs_number": "1942:740"
    }
  ],
  "referenced_publications": [
    "”Banken och posten” NJA 2017 s. 589",
    "”Serverbeslaget” NJA 2020 s. 1119"
  ],
  "pdf_documents": [
    {
      "filename": "T 4262-24.pdf",
      "file_id": "190/c8/6e/c86e2f77-9932-46a1-a56e-dde796afd2eb"
    }
  ],
  "case_url": "https://rattspraxis.etjanst.domstol.se/sok/publicering/8e85109f-15bd-4e44-8069-911ffc33d0fe",
  "correlation_number": "8e85109f-15bd-4e44-8069-911ffc33d0fe",
  "full_text": "Sök rättspraxis\nTillbaka\nSkriv ut\nOm avgörandet\nDomstol:\nHögsta domstolen\nMålnummer:\nT 4262-24\nAvgörandedatum:\n2025-06-25\nLagrum\n10 kap. 17 § rättegångsbalken (1942:740)\n1942:740\nHänvisade rättsfall\n”Banken och posten” NJA 2017 s. 589\n”Serverbeslaget” NJA 2020 s. 1119\nNyckelord\nAllmän domstols behörighe...\nAndelskraft\nErsättningskraft\nFastställelsetalan\nFrikraft\nMark- och miljödomstol\nVattenmål\nT 4262-24\n”Brynge kraftverk”\nAllmän domstol, och inte mark- och miljödomstol, har ansetts behörig att pröva en fastställelsetalan om innebörden av ett villkor om rätt till fri elektrisk kraft i ett utslag av vattendomstol.\nDom eller beslut\npicture_as_pdf\nT 4262-24.pdf\narrow_forward\nÖppnas i en ny flik\nKontakt\nFrågor och svar\nTillgänglighet\nPrenumerera på RSS-flöde"
}