{
  "case_number": "B 9418-24",
  "nickname": "”Utlämning och reseförbud”",
  "summary": "Tvångsmedel vid utlämning för brott. Reseförbud och anmälningsskyldighet har ansetts tillräckligt i förhållande till risken för att den som begärs utlämnad ska undandra sig utlämningsförfarandet.   ",
  "decision_date": "2025-01-30",
  "publication_time": "2025-03-04T15:41:00",
  "case_id": "321713ee-82e7-4e95-bde7-8f69778b4bcb",
  "type": "DOM_ELLER_BESLUT",
  "is_precedent": true,
  "court": "Högsta domstolen",
  "court_code": "HDO",
  "keywords": [
    "Utlämning",
    "Reseförbud",
    "Anmälningsskyldighet",
    "Proportionalitet"
  ],
  "legal_areas": [],
  "legal_references": [
    {
      "reference": "10 § lagen (1957:668) om utlämning för brott",
      "sfs_number": "1957:668"
    },
    {
      "reference": "35 kap. 6 § brottsbalken (1962:700)",
      "sfs_number": "1962:700"
    },
    {
      "reference": "24 kap. 1 § rättegångsbalken (1942:740)",
      "sfs_number": "1942:740"
    },
    {
      "reference": "25 kap. 1 § rättegångsbalken",
      "sfs_number": "1942:740"
    }
  ],
  "referenced_publications": [
    "”Den misstänkte i Dubai” NJA 2007 s. 337",
    "”Utlämningshäktningen” NJA 2011 s. 518",
    "NJA 2012 not 3",
    "”Utlämning och preskription” NJA 2016 s. 1001",
    "”Utlämning och dubbel straffbarhet” NJA 2023 s. 1156"
  ],
  "pdf_documents": [
    {
      "filename": "B 9418-24.pdf",
      "file_id": "190/2c/cb/2ccb3cd0-ffd9-40fd-b006-610e4b1ab152"
    }
  ],
  "case_url": "https://rattspraxis.etjanst.domstol.se/sok/publicering/7b5c6447-9edf-458a-85df-286df5812fbb",
  "correlation_number": "7b5c6447-9edf-458a-85df-286df5812fbb",
  "full_text": "Sök rättspraxis\nTillbaka\nSkriv ut\nOm avgörandet\nDomstol:\nHögsta domstolen\nMålnummer:\nB 9418-24\nAvgörandedatum:\n2025-01-30\nLagrum\n10 § lagen (1957:668) om utlämning för brott\n1957:668\n35 kap. 6 § brottsbalken (1962:700)\n1962:700\n24 kap. 1 § rättegångsbalken (1942:740)\n1942:740\n25 kap. 1 § rättegångsbalken\n1942:740\nHänvisade rättsfall\n”Den misstänkte i Dubai” NJA 2007 s. 337\n”Utlämningshäktningen” NJA 2011 s. 518\nNJA 2012 not 3\n”Utlämning och preskription” NJA 2016 s. 1001\n”Utlämning och dubbel straffbarhet” NJA 2023 s. 1156\nNyckelord\nUtlämning\nReseförbud\nAnmälningsskyldighet\nProportionalitet\nB 9418-24\n”Utlämning och reseförbud”\nTvångsmedel vid utlämning för brott. Reseförbud och anmälningsskyldighet har ansetts tillräckligt i förhållande till risken för att den som begärs utlämnad ska undandra sig utlämningsförfarandet.\nDom eller beslut\npicture_as_pdf\nB 9418-24.pdf\narrow_forward\nÖppnas i en ny flik\nKontakt\nFrågor och svar\nTillgänglighet\nPrenumerera på RSS-flöde"
}