{
  "case_number": "Ö 7177-23",
  "nickname": "\"Klimattalan\"",
  "summary": "Tillåtligheten av en klimattalan.",
  "decision_date": "2025-02-19",
  "publication_time": "2025-03-04T16:05:00",
  "case_id": "b668971c-d514-48c0-abc6-37143b08aabb",
  "type": "DOM_ELLER_BESLUT",
  "is_precedent": true,
  "court": "Högsta domstolen",
  "court_code": "HDO",
  "keywords": [
    "Klimattalan",
    "Europakonventionen",
    "Fastställelsetalan",
    "Fullgörelsetalan",
    "Rätten till domstolsprövning",
    "Rätten till privatliv",
    "Rättskipning",
    "Talerätt"
  ],
  "legal_areas": [],
  "legal_references": [
    {
      "reference": "1 kap. 8 § regeringsformen",
      "sfs_number": "1974:152"
    },
    {
      "reference": "2 kap. 9 § regeringsformen",
      "sfs_number": "1974:152"
    },
    {
      "reference": "11 kap. 3 § regeringsformen (1974:152)",
      "sfs_number": "1974:152"
    },
    {
      "reference": "11 kap. 4 § regeringsformen",
      "sfs_number": "1974:152"
    },
    {
      "reference": "11 kap. 5 § regeringsformen",
      "sfs_number": "1974:152"
    },
    {
      "reference": "13 kap. 1 § rättegångsbalken (1942:740)",
      "sfs_number": "1942:740"
    },
    {
      "reference": "13 kap. 2 § rättegångsbalken (1942:740)",
      "sfs_number": "1942:740"
    },
    {
      "reference": "Artikel 6 i Europakonventionen",
      "sfs_number": ""
    },
    {
      "reference": "Artikel 8 i Europakonventionen",
      "sfs_number": ""
    }
  ],
  "referenced_publications": [
    "”Talan om annans rätt” NJA 1984 s. 215",
    "”Riksdagens anslagsbeslut” NJA 1988 s. 15",
    "”Unibet II” NJA 2007 s. 718",
    "”Den långsamma tingsrätten” NJA 2012 s. 211 I",
    "”Miljöprocesserna i USA” NJA 2013 s. 209",
    "”Kezban” NJA 2013 s. 842",
    "[\"NJA 2018 s. 114\",\"NJA 2018:10\"]",
    "Kudła v. Poland [GC], no. 30210/96, ECHR 2000-XI",
    "Tamazount and Others v. France, no 17131/19, 4 April 2024",
    "Verein KlimaSeniorinnen Schweiz and Others v. Switzerland [GC], no 53600/20, 9 April 2024",
    "EU-domstolens dom Åkerberg Fransson, C-617/10, EU:C:2013:105"
  ],
  "pdf_documents": [
    {
      "filename": "Ö 7177-23.pdf",
      "file_id": "190/53/c2/53c21139-3340-4402-bb23-f0b5ae1993e3"
    }
  ],
  "case_url": "https://rattspraxis.etjanst.domstol.se/sok/publicering/aa549249-8d8a-4cda-9c03-6e7a764a6c18",
  "correlation_number": "aa549249-8d8a-4cda-9c03-6e7a764a6c18",
  "full_text": "Sök rättspraxis\nTillbaka\nSkriv ut\nOm avgörandet\nDomstol:\nHögsta domstolen\nMålnummer:\nÖ 7177-23\nAvgörandedatum:\n2025-02-19\nEuroparättsligt avgörande:\nJa\nLagrum\n1 kap. 8 § regeringsformen\n1974:152\n2 kap. 9 § regeringsformen\n1974:152\n11 kap. 3 § regeringsformen (1974:152)\n1974:152\n11 kap. 4 § regeringsformen\n1974:152\n11 kap. 5 § regeringsformen\n1974:152\n13 kap. 1 § rättegångsbalken (1942:740)\n1942:740\n13 kap. 2 § rättegångsbalken (1942:740)\n1942:740\nArtikel 6 i Europakonventionen\nArtikel 8 i Europakonventionen\nHänvisade rättsfall\n”Talan om annans rätt” NJA 1984 s. 215\n”Riksdagens anslagsbeslut” NJA 1988 s. 15\n”Unibet II” NJA 2007 s. 718\n”Den långsamma tingsrätten” NJA 2012 s. 211 I\n”Miljöprocesserna i USA” NJA 2013 s. 209\n”Kezban” NJA 2013 s. 842\nNJA 2018 s. 114, NJA 2018:10\nKudła v. Poland [GC], no. 30210/96, ECHR 2000-XI\nTamazount and Others v. France, no 17131/19, 4 April 2024\nVerein KlimaSeniorinnen Schweiz and Others v. Switzerland [GC], no 53600/20, 9 April 2024\nEU-domstolens dom Åkerberg Fransson, C-617/10, EU:C:2013:105\nNyckelord\nKlimattalan\nEuropakonventionen\nFastställelsetalan\nFullgörelsetalan\nRätten till domstolsprövn...\nRätten till privatliv\nRättskipning\nTalerätt\nÖ 7177-23\n\"Klimattalan\"\nTillåtligheten av en klimattalan.\nDom eller beslut\npicture_as_pdf\nÖ 7177-23.pdf\narrow_forward\nÖppnas i en ny flik\nKontakt\nFrågor och svar\nTillgänglighet\nPrenumerera på RSS-flöde"
}