{
  "case_number": "T 5269-23",
  "nickname": "”Panelvirket\"",
  "summary": "Fråga om en köpare i rätt tid har reklamerat fel i ett parti panelvirke som köparen låtit lackera före vidareförsäljning.",
  "decision_date": "2025-06-24",
  "publication_time": "2025-06-24T08:45:00",
  "case_id": "114df16f-5cd7-4443-9039-e6c298bba110",
  "type": "DOM_ELLER_BESLUT",
  "is_precedent": true,
  "court": "Högsta domstolen",
  "court_code": "HDO",
  "keywords": [
    "Reklamation",
    "Fel",
    "Köp",
    "Köparens undersökning",
    "Vidareförsäljning"
  ],
  "legal_areas": [],
  "legal_references": [
    {
      "reference": "31 § köplagen (1990:931)",
      "sfs_number": "1990:931"
    },
    {
      "reference": "32 § köplagen (1990:931)",
      "sfs_number": "1990:931"
    }
  ],
  "referenced_publications": [
    "”Bostadsrättslokalen” NJA 2016 s. 237"
  ],
  "pdf_documents": [
    {
      "filename": "T 5269-23.pdf",
      "file_id": "190/e7/30/e7303f38-a1af-4df3-baff-50e54dc83b52"
    }
  ],
  "case_url": "https://rattspraxis.etjanst.domstol.se/sok/publicering/15c59f29-1704-4b24-8ab0-b1ef3c729add",
  "correlation_number": "15c59f29-1704-4b24-8ab0-b1ef3c729add",
  "full_text": "Sök rättspraxis\nTillbaka\nSkriv ut\nOm avgörandet\nDomstol:\nHögsta domstolen\nMålnummer:\nT 5269-23\nAvgörandedatum:\n2025-06-24\nLagrum\n31 § köplagen (1990:931)\n1990:931\n32 § köplagen (1990:931)\n1990:931\nHänvisade rättsfall\n”Bostadsrättslokalen” NJA 2016 s. 237\nNyckelord\nReklamation\nFel\nKöp\nKöparens undersökning\nVidareförsäljning\nT 5269-23\n”Panelvirket\"\nFråga om en köpare i rätt tid har reklamerat fel i ett parti panelvirke som köparen låtit lackera före vidareförsäljning.\nDom eller beslut\npicture_as_pdf\nT 5269-23.pdf\narrow_forward\nÖppnas i en ny flik\nKontakt\nFrågor och svar\nTillgänglighet\nPrenumerera på RSS-flöde"
}