{
  "case_number": "T 1241-24",
  "nickname": "\"Den oregistrerade bouppteckningen”\"",
  "summary": "Fråga om det har funnits skäl att upphäva ett beslut om arvskifte och återförvisa ärendet när någon bouppteckning inte registrerats av Skatteverket och skiftessammanträde inte hållits.",
  "decision_date": "2025-06-19",
  "publication_time": "2025-06-19T09:19:00",
  "case_id": "f67e46cc-a8ab-4bfe-ab56-0d95dd2f6973",
  "type": "DOM_ELLER_BESLUT",
  "is_precedent": true,
  "court": "Högsta domstolen",
  "court_code": "HDO",
  "keywords": [
    "Arvskifte",
    "Bouppteckning",
    "Förrättning",
    "Klandertalan",
    "Skiftesman",
    "Skiftessammanträde"
  ],
  "legal_areas": [],
  "legal_references": [
    {
      "reference": "20 kap. 1 § ärvdabalken (1958:637) ",
      "sfs_number": "1958:637"
    },
    {
      "reference": "20 kap. 2 § ärvdabalken (1958:637) ",
      "sfs_number": "1958:637"
    },
    {
      "reference": "20 kap. 9 § ärvdabalken (1958:637)",
      "sfs_number": "1958:637"
    },
    {
      "reference": "23 kap. 2 § ärvdabalken (1958:637)",
      "sfs_number": "1958:637"
    },
    {
      "reference": "23 kap. 5 § ärvdabalken (1958:637)",
      "sfs_number": "1958:637"
    },
    {
      "reference": "17 kap. 6 § äktenskapsbalken (1987:230) ",
      "sfs_number": "1987:230"
    },
    {
      "reference": "17 kap. 8 § äktenskapsbalken (1987:230)",
      "sfs_number": "1987:230"
    }
  ],
  "referenced_publications": [
    "”Den oavslutade bouppteckningen” NJA 2009 s. 717",
    "”Stinas bouppteckning” NJA 2018 s. 341",
    "”Boutredningsmannens bedömning” NJA 2023 s. 761"
  ],
  "pdf_documents": [
    {
      "filename": "T 1241-24.pdf",
      "file_id": "190/a9/f9/a9f9f97b-6407-4b1a-82ae-f342d29988b8"
    }
  ],
  "case_url": "https://rattspraxis.etjanst.domstol.se/sok/publicering/b1a7620d-5709-4d3b-831f-28298724c038",
  "correlation_number": "b1a7620d-5709-4d3b-831f-28298724c038",
  "full_text": "Sök rättspraxis\nTillbaka\nSkriv ut\nOm avgörandet\nDomstol:\nHögsta domstolen\nMålnummer:\nT 1241-24\nAvgörandedatum:\n2025-06-19\nLagrum\n20 kap. 1 § ärvdabalken (1958:637)\n1958:637\n20 kap. 2 § ärvdabalken (1958:637)\n1958:637\n20 kap. 9 § ärvdabalken (1958:637)\n1958:637\n23 kap. 2 § ärvdabalken (1958:637)\n1958:637\n23 kap. 5 § ärvdabalken (1958:637)\n1958:637\n17 kap. 6 § äktenskapsbalken (1987:230)\n1987:230\n17 kap. 8 § äktenskapsbalken (1987:230)\n1987:230\nHänvisade rättsfall\n”Den oavslutade bouppteckningen” NJA 2009 s. 717\n”Stinas bouppteckning” NJA 2018 s. 341\n”Boutredningsmannens bedömning” NJA 2023 s. 761\nNyckelord\nArvskifte\nBouppteckning\nFörrättning\nKlandertalan\nSkiftesman\nSkiftessammanträde\nT 1241-24\n\"Den oregistrerade bouppteckningen”\"\nFråga om det har funnits skäl att upphäva ett beslut om arvskifte och återförvisa ärendet när någon bouppteckning inte registrerats av Skatteverket och skiftessammanträde inte hållits.\nDom eller beslut\npicture_as_pdf\nT 1241-24.pdf\narrow_forward\nÖppnas i en ny flik\nKontakt\nFrågor och svar\nTillgänglighet\nPrenumerera på RSS-flöde"
}