{
  "case_number": "ÖM 3311-24",
  "nickname": "”Vändle bergtäkt”",
  "summary": "Ett överklagande i ett ansökningsmål enligt miljöbalken har avvisats. Fråga om det funnits skäl att vidta ytterligare åtgärder för att klargöra vem som var klagande. ",
  "decision_date": "2025-06-17",
  "publication_time": "2025-06-17T08:45:00",
  "case_id": "065f8c61-594d-43b1-8f07-9fd26bcee9f6",
  "type": "DOM_ELLER_BESLUT",
  "is_precedent": true,
  "court": "Högsta domstolen",
  "court_code": "HDO",
  "keywords": [
    "Avvisning",
    "Ansökningsmål enligt miljöbalken",
    "Processledning",
    "Utredningsskyldighet",
    "Överklagande"
  ],
  "legal_areas": [],
  "legal_references": [
    {
      "reference": "50 kap. 7 § rättegångsbalken (1942:740)",
      "sfs_number": "1942:740"
    },
    {
      "reference": "16 kap. 12 § miljöbalken (1998:808)",
      "sfs_number": "1998:808"
    },
    {
      "reference": "22 kap. 6 § miljöbalken (1998:808)",
      "sfs_number": "1998:808"
    }
  ],
  "referenced_publications": [],
  "pdf_documents": [
    {
      "filename": "ÖM 3311-24.pdf",
      "file_id": "190/69/29/6929daa4-89d2-4f09-bafd-f0542e81520e"
    }
  ],
  "case_url": "https://rattspraxis.etjanst.domstol.se/sok/publicering/6423afe2-dc02-4586-a4be-1e2a43b489cf",
  "correlation_number": "6423afe2-dc02-4586-a4be-1e2a43b489cf",
  "full_text": "Sök rättspraxis\nTillbaka\nSkriv ut\nOm avgörandet\nDomstol:\nHögsta domstolen\nMålnummer:\nÖM 3311-24\nAvgörandedatum:\n2025-06-17\nLagrum\n50 kap. 7 § rättegångsbalken (1942:740)\n1942:740\n16 kap. 12 § miljöbalken (1998:808)\n1998:808\n22 kap. 6 § miljöbalken (1998:808)\n1998:808\nNyckelord\nAvvisning\nAnsökningsmål enligt milj...\nProcessledning\nUtredningsskyldighet\nÖverklagande\nÖM 3311-24\n”Vändle bergtäkt”\nEtt överklagande i ett ansökningsmål enligt miljöbalken har avvisats. Fråga om det funnits skäl att vidta ytterligare åtgärder för att klargöra vem som var klagande.\nDom eller beslut\npicture_as_pdf\nÖM 3311-24.pdf\narrow_forward\nÖppnas i en ny flik\nKontakt\nFrågor och svar\nTillgänglighet\nPrenumerera på RSS-flöde"
}