{
  "case_number": "B 3779-24",
  "nickname": "\"Restaurangdörren\"",
  "summary": "Fråga om ett olaga intrång som har skett genom inbrott ska bedömas som grovt.",
  "decision_date": "2025-01-03",
  "publication_time": "2025-05-15T09:13:00",
  "case_id": "41e0d2b3-c1cd-4b7e-a387-194c20c0088f",
  "type": "DOM_ELLER_BESLUT",
  "is_precedent": true,
  "court": "Högsta domstolen",
  "court_code": "HDO",
  "keywords": [
    "Olaga intrång",
    "Inbrott",
    "Rubricering"
  ],
  "legal_areas": [],
  "legal_references": [
    {
      "reference": "4 kap. 6 § brottsbalken (1962:700)",
      "sfs_number": "1962:700"
    }
  ],
  "referenced_publications": [
    "\"Trapphuset vid Renmarkstorget” NJA 1987 s. 148",
    "”Inbrottet på Fredsgatan” NJA 1990 s. 315",
    "”Skrantahallen” NJA 1995 s. 84",
    "”Djurrättsaktionerna” NJA 2009 s. 636",
    "”Pianobäraren” NJA 2024 s. 12",
    "”Vinkelslipen” NJA 2024 s. 335"
  ],
  "pdf_documents": [
    {
      "filename": "B 3779-24.pdf",
      "file_id": "190/7b/96/7b96f0d1-162e-450f-8762-4f3f88f7ada9"
    }
  ],
  "case_url": "https://rattspraxis.etjanst.domstol.se/sok/publicering/5055ef75-7fb5-479a-ad18-a3320ec0b101",
  "correlation_number": "5055ef75-7fb5-479a-ad18-a3320ec0b101",
  "full_text": "Sök rättspraxis\nTillbaka\nSkriv ut\nOm avgörandet\nDomstol:\nHögsta domstolen\nMålnummer:\nB 3779-24\nAvgörandedatum:\n2025-01-03\nLagrum\n4 kap. 6 § brottsbalken (1962:700)\n1962:700\nHänvisade rättsfall\n\"Trapphuset vid Renmarkstorget” NJA 1987 s. 148\n”Inbrottet på Fredsgatan” NJA 1990 s. 315\n”Skrantahallen” NJA 1995 s. 84\n”Djurrättsaktionerna” NJA 2009 s. 636\n”Pianobäraren” NJA 2024 s. 12\n”Vinkelslipen” NJA 2024 s. 335\nNyckelord\nOlaga intrång\nInbrott\nRubricering\nB 3779-24\n\"Restaurangdörren\"\nFråga om ett olaga intrång som har skett genom inbrott ska bedömas som grovt.\nDom eller beslut\npicture_as_pdf\nB 3779-24.pdf\narrow_forward\nÖppnas i en ny flik\nKontakt\nFrågor och svar\nTillgänglighet\nPrenumerera på RSS-flöde"
}