{
  "case_number": "T 5424-24",
  "nickname": "”Samägandet i Enskede”",
  "summary": "Om den som har ingått ett avtal om att hyra egendom blir samägare till egendomen, kan avtalet inte längre göras gällande som ett hyresförhållande. ",
  "decision_date": "2025-04-25",
  "publication_time": "2025-04-25T08:45:00",
  "case_id": "814a618f-d72d-44f2-9c6c-5a20420e3372",
  "type": "DOM_ELLER_BESLUT",
  "is_precedent": true,
  "court": "Högsta domstolen",
  "court_code": "HDO",
  "keywords": [
    "Samägande",
    "Avhysning",
    "Besittningsskydd",
    "Förvaltningsavtal",
    "Hyra",
    "Hyresavtal",
    "Nyttjanderätt",
    "Samäganderätt"
  ],
  "legal_areas": [],
  "legal_references": [
    {
      "reference": "1 § lagen (1904:48 s. 1) om samäganderätt",
      "sfs_number": "1904:48"
    }
  ],
  "referenced_publications": [
    "”Samägandet i Vislanda” NJA 1952 s. 37"
  ],
  "pdf_documents": [
    {
      "filename": "T 5424-24.pdf",
      "file_id": "190/43/0d/430d836f-cd64-407e-b7ef-12636ec74270"
    }
  ],
  "case_url": "https://rattspraxis.etjanst.domstol.se/sok/publicering/75fda8ce-1544-4e4c-9562-fd4ad9c49495",
  "correlation_number": "75fda8ce-1544-4e4c-9562-fd4ad9c49495",
  "full_text": "Sök rättspraxis\nTillbaka\nSkriv ut\nOm avgörandet\nDomstol:\nHögsta domstolen\nMålnummer:\nT 5424-24\nAvgörandedatum:\n2025-04-25\nLagrum\n1 § lagen (1904:48 s. 1) om samäganderätt\n1904:48\nHänvisade rättsfall\n”Samägandet i Vislanda” NJA 1952 s. 37\nNyckelord\nSamägande\nAvhysning\nBesittningsskydd\nFörvaltningsavtal\nHyra\nHyresavtal\nNyttjanderätt\nSamäganderätt\nT 5424-24\n”Samägandet i Enskede”\nOm den som har ingått ett avtal om att hyra egendom blir samägare till egendomen, kan avtalet inte längre göras gällande som ett hyresförhållande.\nDom eller beslut\npicture_as_pdf\nT 5424-24.pdf\narrow_forward\nÖppnas i en ny flik\nKontakt\nFrågor och svar\nTillgänglighet\nPrenumerera på RSS-flöde"
}