{
  "case_number": "T 9030-23",
  "nickname": "”Brf Ida”",
  "summary": "Tolkning av standardavtal (Allmänna bestämmelser för entreprenader inom fastighetsförvaltning och verksamhetsanknutna tjänster, ABFF 04). En avtalsbestämmelse med en frist för att framställa krav på grund av fel har inte angett någon rättsföljd för underlåtenhet att följa fristen. Det har inte funnits klara hållpunkter för att tolka bestämmelsen så att rätten att göra gällande kravet går förlorad om det inte framställs inom fristen.",
  "decision_date": "2025-04-24",
  "publication_time": "2025-04-24T08:45:00",
  "case_id": "6e5f94ef-3b56-4566-87e6-0032689bc28b",
  "type": "DOM_ELLER_BESLUT",
  "is_precedent": true,
  "court": "Högsta domstolen",
  "court_code": "HDO",
  "keywords": [
    "Avtalstolkning",
    "Preskription",
    "Reklamation",
    "Standardavtal"
  ],
  "legal_areas": [],
  "legal_references": [],
  "referenced_publications": [
    "”Bergkristallen 19” NJA 1964 s. 152",
    "”Den uteblivna slutbesiktningen” NJA 2015 s. 862"
  ],
  "pdf_documents": [
    {
      "filename": "T 9030-23.pdf",
      "file_id": "190/df/af/dfaf1c26-8098-46ba-8fde-b464f5ed3423"
    }
  ],
  "case_url": "https://rattspraxis.etjanst.domstol.se/sok/publicering/3d448733-d2aa-4a7e-a79a-8613cd643aa6",
  "correlation_number": "3d448733-d2aa-4a7e-a79a-8613cd643aa6",
  "full_text": "Sök rättspraxis\nTillbaka\nSkriv ut\nOm avgörandet\nDomstol:\nHögsta domstolen\nMålnummer:\nT 9030-23\nAvgörandedatum:\n2025-04-24\nHänvisade rättsfall\n”Bergkristallen 19” NJA 1964 s. 152\n”Den uteblivna slutbesiktningen” NJA 2015 s. 862\nNyckelord\nAvtalstolkning\nPreskription\nReklamation\nStandardavtal\nT 9030-23\n”Brf Ida”\nTolkning av standardavtal (Allmänna bestämmelser för entreprenader inom fastighetsförvaltning och verksamhetsanknutna tjänster, ABFF 04). En avtalsbestämmelse med en frist för att framställa krav på grund av fel har inte angett någon rättsföljd för underlåtenhet att följa fristen. Det har inte funnits klara hållpunkter för att tolka bestämmelsen så att rätten att göra gällande kravet går förlorad om det inte framställs inom fristen.\n- Visa mindre innehåll\nDom eller beslut\npicture_as_pdf\nT 9030-23.pdf\narrow_forward\nÖppnas i en ny flik\nKontakt\nFrågor och svar\nTillgänglighet\nPrenumerera på RSS-flöde"
}