{
  "case_number": "Ö 9115-24",
  "nickname": "”Häktning och utvidgat överlämnande”",
  "summary": "Det är möjligt att villkora ett beslut om häktning för att få till stånd ett utvidgat överlämnande inom ramen för systemet med en europeisk arresteringsorder",
  "decision_date": "2025-03-14",
  "publication_time": "2025-03-14T08:45:00",
  "case_id": "84846ff9-40c9-4ef8-a9b5-c14cde8f730f",
  "type": "DOM_ELLER_BESLUT",
  "is_precedent": true,
  "court": "Högsta domstolen",
  "court_code": "HDO",
  "keywords": [
    "Häktning",
    "Villkorad häktning",
    "Utvidgat överlämnande",
    "Europeisk arresteringsorder"
  ],
  "legal_areas": [],
  "legal_references": [
    {
      "reference": "24 kap. 1 § rättegångsbalken (1942:740)",
      "sfs_number": "1942:740"
    },
    {
      "reference": "17 § förordningen (2003:1178) om överlämnande till Sverige enligt en europeisk arresteringsorder ",
      "sfs_number": "2003:1178"
    },
    {
      "reference": "artikel 8 i rambeslutet om en europeisk arresteringsorder",
      "sfs_number": ""
    },
    {
      "reference": "artikel 27 i rambeslutet om en europeisk arresteringsorder",
      "sfs_number": ""
    }
  ],
  "referenced_publications": [
    "”Svartlösadomen” NJA 1976 s. 522",
    "”La Reine-häktningen”  NJA 1993 s. 161",
    "och ”Villkorad häktning” NJA 2024 s. 81 ",
    "Bob-Dogi, C-241/15, EU:C:2016:385"
  ],
  "pdf_documents": [
    {
      "filename": "Ö 9115-24.pdf",
      "file_id": "190/cb/72/cb72e5a4-44c8-4d40-99ae-905711e78126"
    }
  ],
  "case_url": "https://rattspraxis.etjanst.domstol.se/sok/publicering/65f62faf-06a4-4646-bcd0-9fd5b65cba40",
  "correlation_number": "65f62faf-06a4-4646-bcd0-9fd5b65cba40",
  "full_text": "Sök rättspraxis\nTillbaka\nSkriv ut\nOm avgörandet\nDomstol:\nHögsta domstolen\nMålnummer:\nÖ 9115-24\nAvgörandedatum:\n2025-03-14\nEuroparättsligt avgörande:\nJa\nLagrum\n24 kap. 1 § rättegångsbalken (1942:740)\n1942:740\n17 § förordningen (2003:1178) om överlämnande till Sverige enligt en europeisk arresteringsorder\n2003:1178\nartikel 8 i rambeslutet om en europeisk arresteringsorder\nartikel 27 i rambeslutet om en europeisk arresteringsorder\nHänvisade rättsfall\n”Svartlösadomen” NJA 1976 s. 522\n”La Reine-häktningen” NJA 1993 s. 161\noch ”Villkorad häktning” NJA 2024 s. 81\nBob-Dogi, C-241/15, EU:C:2016:385\nNyckelord\nHäktning\nVillkorad häktning\nUtvidgat överlämnande\nEuropeisk arresteringsord...\nÖ 9115-24\n”Häktning och utvidgat överlämnande”\nDet är möjligt att villkora ett beslut om häktning för att få till stånd ett utvidgat överlämnande inom ramen för systemet med en europeisk arresteringsorder\nDom eller beslut\npicture_as_pdf\nÖ 9115-24.pdf\narrow_forward\nÖppnas i en ny flik\nKontakt\nFrågor och svar\nTillgänglighet\nPrenumerera på RSS-flöde"
}