{
  "case_number": "T 5449-23",
  "nickname": "\"Deckarserien\"",
  "summary": "De särskilda upphovsrättsliga hänsyn som kan behöva tas vid tolkning av upphovsrättsliga avtal ska samverka med vad som gäller för avtalstolkning i allmänhet. Det innebär att sådana särskilda hänsyn får vägas in som preciserande och kompletterande omständigheter vid bedömningen av och avvägningen mellan olika tolkningsfaktorer hänförliga till det enskilda avtalet, men inte i form av att några speciella tolkningsprinciper ska anses gälla. ",
  "decision_date": "2025-02-28",
  "publication_time": "2025-03-04T15:45:00",
  "case_id": "d7548f33-57db-4afc-978e-f366e8842f0c",
  "type": "DOM_ELLER_BESLUT",
  "is_precedent": true,
  "court": "Högsta domstolen",
  "court_code": "HDO",
  "keywords": [
    "Avtalstolkning",
    "Upphovsrättsavtal"
  ],
  "legal_areas": [],
  "legal_references": [
    {
      "reference": "27 § lagen (1960:729) om upphovsrätt till litterära och konstnärliga verk",
      "sfs_number": "1960:729"
    }
  ],
  "referenced_publications": [
    "”Skivomslaget” NJA 2010 s. 559",
    "”Mätarställningen” NJA 2021 s. 597",
    "”Epidemiavbrottsförsäkringen” NJA 2023 s. 630"
  ],
  "pdf_documents": [
    {
      "filename": "T 5449-23.pdf",
      "file_id": "190/a9/82/a9827ce9-7ffa-4874-aebf-5c7b6d3ddfc2"
    }
  ],
  "case_url": "https://rattspraxis.etjanst.domstol.se/sok/publicering/da3d0d33-01b6-42b8-a887-2f71f1d7cca0",
  "correlation_number": "da3d0d33-01b6-42b8-a887-2f71f1d7cca0",
  "full_text": "Sök rättspraxis\nTillbaka\nSkriv ut\nOm avgörandet\nDomstol:\nHögsta domstolen\nMålnummer:\nT 5449-23\nAvgörandedatum:\n2025-02-28\nLagrum\n27 § lagen (1960:729) om upphovsrätt till litterära och konstnärliga verk\n1960:729\nHänvisade rättsfall\n”Skivomslaget” NJA 2010 s. 559\n”Mätarställningen” NJA 2021 s. 597\n”Epidemiavbrottsförsäkringen” NJA 2023 s. 630\nNyckelord\nAvtalstolkning\nUpphovsrättsavtal\nT 5449-23\n\"Deckarserien\"\nDe särskilda upphovsrättsliga hänsyn som kan behöva tas vid tolkning av upphovsrättsliga avtal ska samverka med vad som gäller för avtalstolkning i allmänhet. Det innebär att sådana särskilda hänsyn får vägas in som preciserande och kompletterande omständigheter vid bedömningen av och avvägningen mellan olika tolkningsfaktorer hänförliga till det enskilda avtalet, men inte i form av att några speciella tolkningsprinciper ska anses gälla.\n- Visa mindre innehåll\nDom eller beslut\npicture_as_pdf\nT 5449-23.pdf\narrow_forward\nÖppnas i en ny flik\nKontakt\nFrågor och svar\nTillgänglighet\nPrenumerera på RSS-flöde"
}