{
  "case_number": "B 5428-24",
  "nickname": "\"Jackan\"",
  "summary": "En gärning som uppfyller rekvisiten för rån har med tillämpning av 8 kap. 5 § fjärde stycket brottsbalken bedömts vara av mindre allvarlig art och i stället rubricerats som grov stöld.   ",
  "decision_date": "2025-03-13",
  "publication_time": "2025-03-13T08:45:00",
  "case_id": "63111efa-cb7b-4b43-ae98-d47f35428ef8",
  "type": "DOM_ELLER_BESLUT",
  "is_precedent": true,
  "court": "Högsta domstolen",
  "court_code": "HDO",
  "keywords": [
    "Rån",
    "Grov stöld",
    "Mindre allvarlig art"
  ],
  "legal_areas": [],
  "legal_references": [
    {
      "reference": "8 kap. 5 § brottsbalken (1962:700)",
      "sfs_number": "(1962:700)"
    }
  ],
  "referenced_publications": [
    "”Motvärnet i butiken” NJA 1976 s. 689 B",
    "”Rånet i Solberga” NJA 1977 s. 329",
    "”Rånet i lägenheten” NJA 1981 s. 273",
    "”Gaturånet” NJA 1991 s. 444",
    "”Meneden om misshandeln i Bjuv” NJA 1999  s. 561",
    "”Två DVD-filmer” NJA 2008 s. 900",
    "”De kinesiska kullagren” NJA 2014 s. 559"
  ],
  "pdf_documents": [
    {
      "filename": "B 5428-24.pdf",
      "file_id": "190/85/b0/85b09703-739a-41dd-a4e8-249ac2a3fa60"
    }
  ],
  "case_url": "https://rattspraxis.etjanst.domstol.se/sok/publicering/7d7a7926-4d1e-4562-886b-db03ce8fbd4d",
  "correlation_number": "7d7a7926-4d1e-4562-886b-db03ce8fbd4d",
  "full_text": "Sök rättspraxis\nTillbaka\nSkriv ut\nOm avgörandet\nDomstol:\nHögsta domstolen\nMålnummer:\nB 5428-24\nAvgörandedatum:\n2025-03-13\nLagrum\n8 kap. 5 § brottsbalken (1962:700)\n(1962:700)\nHänvisade rättsfall\n”Motvärnet i butiken” NJA 1976 s. 689 B\n”Rånet i Solberga” NJA 1977 s. 329\n”Rånet i lägenheten” NJA 1981 s. 273\n”Gaturånet” NJA 1991 s. 444\n”Meneden om misshandeln i Bjuv” NJA 1999 s. 561\n”Två DVD-filmer” NJA 2008 s. 900\n”De kinesiska kullagren” NJA 2014 s. 559\nNyckelord\nRån\nGrov stöld\nMindre allvarlig art\nB 5428-24\n\"Jackan\"\nEn gärning som uppfyller rekvisiten för rån har med tillämpning av 8 kap. 5 § fjärde stycket brottsbalken bedömts vara av mindre allvarlig art och i stället rubricerats som grov stöld.\nDom eller beslut\npicture_as_pdf\nB 5428-24.pdf\narrow_forward\nÖppnas i en ny flik\nKontakt\nFrågor och svar\nTillgänglighet\nPrenumerera på RSS-flöde"
}