{
  "case_number": "B 4243-24",
  "nickname": "”TV-rummet”",
  "summary": "Rubricering av sexuellt övergrepp mot barn och barnfridsbrott. Även fråga om brottslighetskonkurrens när ett händelseförlopp innefattar flera olika brott. ",
  "decision_date": "2025-04-17",
  "publication_time": "2025-04-17T08:53:00",
  "case_id": "edae548c-195f-4bf6-851f-1f21be39fdd7",
  "type": "DOM_ELLER_BESLUT",
  "is_precedent": true,
  "court": "Högsta domstolen",
  "court_code": "HDO",
  "keywords": [
    "Sexuellt övergrepp mot barn",
    "Brottslighetskonkurrens;",
    "Barnfridsbrott",
    "Rubricering",
    "Sexuellt ofredande mot barn"
  ],
  "legal_areas": [],
  "legal_references": [
    {
      "reference": "4 kap. 3 § brottsbalken (1962:700)",
      "sfs_number": "1962:700"
    },
    {
      "reference": "6 kap. 6 § brottsbalken",
      "sfs_number": "1962:700"
    },
    {
      "reference": "6 kap. 10 § brottsbalken",
      "sfs_number": "1962:700"
    }
  ],
  "referenced_publications": [
    "[\"NJA 2006 s. 221\",\"NJA 2006:28\"]",
    "NJA 2008 s. 1096 I och II",
    "”Tejpningen”  NJA 2013 s. 397",
    "”Påskupploppet i Örebro” NJA 2023 s. 114",
    "”Jackan” Högsta domstolens dom den 13 mars 2025 i mål  B 5428-24"
  ],
  "pdf_documents": [
    {
      "filename": "B 4243-24.pdf",
      "file_id": "190/cd/41/cd4151c8-d0aa-4d21-b534-feb3b7e278ca"
    }
  ],
  "case_url": "https://rattspraxis.etjanst.domstol.se/sok/publicering/269f3c70-3ebc-489b-a79e-87afc97b4634",
  "correlation_number": "269f3c70-3ebc-489b-a79e-87afc97b4634",
  "full_text": "Sök rättspraxis\nTillbaka\nSkriv ut\nOm avgörandet\nDomstol:\nHögsta domstolen\nMålnummer:\nB 4243-24\nAvgörandedatum:\n2025-04-17\nLagrum\n4 kap. 3 § brottsbalken (1962:700)\n1962:700\n6 kap. 6 § brottsbalken\n1962:700\n6 kap. 10 § brottsbalken\n1962:700\nHänvisade rättsfall\nNJA 2006 s. 221, NJA 2006:28\nNJA 2008 s. 1096 I och II\n”Tejpningen” NJA 2013 s. 397\n”Påskupploppet i Örebro” NJA 2023 s. 114\n”Jackan” Högsta domstolens dom den 13 mars 2025 i mål B 5428-24\nNyckelord\nSexuellt övergrepp mot ba...\nBrottslighetskonkurrens;\nBarnfridsbrott\nRubricering\nSexuellt ofredande mot ba...\nB 4243-24\n”TV-rummet”\nRubricering av sexuellt övergrepp mot barn och barnfridsbrott. Även fråga om brottslighetskonkurrens när ett händelseförlopp innefattar flera olika brott.\nDom eller beslut\npicture_as_pdf\nB 4243-24.pdf\narrow_forward\nÖppnas i en ny flik\nKontakt\nFrågor och svar\nTillgänglighet\nPrenumerera på RSS-flöde"
}