{
  "case_number": "Ö 438-24",
  "nickname": "”Regionens medgivande”",
  "summary": "I ett mål rörande skadestånd på grund av en överträdelse av grundläggande fri- och rättigheter har svaranden medgett betalning, men förklarat att medgivandet inte innebär ett erkännande av någon överträdelse (ett s.k. orent medgivande). Domstolen bör i en sådan situation tillämpa de processrättsliga bestämmelserna på så sätt att domstolen dömer i enlighet med medgivandet och samtidigt, inom ramen för en fastställelsetalan, tar ställning till om det har förekommit en rättighetsöverträdelse.",
  "decision_date": "2025-03-28",
  "publication_time": "2025-03-31T12:33:00",
  "case_id": "ece05dd3-31a4-4fe2-a5b6-1fdca9b97966",
  "type": "DOM_ELLER_BESLUT",
  "is_precedent": true,
  "court": "Högsta domstolen",
  "court_code": "HDO",
  "keywords": [
    "Medgivande",
    "Dispositionsprincipen",
    "Fastställelsetalan",
    "Skadestånd"
  ],
  "legal_areas": [],
  "legal_references": [
    {
      "reference": "13 kap. 2 § rättegångsbalken (1942:740)",
      "sfs_number": "1942:740"
    },
    {
      "reference": "17 kap. 3 § rättegångsbalken (1942:740)",
      "sfs_number": "1942:740"
    },
    {
      "reference": "41 kap. 18 § rättegångsbalken (1942:740)",
      "sfs_number": "1942:740"
    },
    {
      "reference": "Europakonventionen artikel 13",
      "sfs_number": ""
    }
  ],
  "referenced_publications": [
    "”Truebell” NJA 1977 s. 349",
    "”Den medgivna hävningen”  NJA 1986 s. 205",
    "”Miljöprocesserna i USA” NJA 2013 s. 209",
    "”Flygbolagets medgivande” NJA 2021 s. 1093",
    "”Klimattalan” Högsta domstolens beslut den 19 februari 2025 i mål Ö 7177-23"
  ],
  "pdf_documents": [
    {
      "filename": "Ö 438-24.pdf",
      "file_id": "190/3c/13/3c130af1-81a8-44af-9507-8d774897482b"
    }
  ],
  "case_url": "https://rattspraxis.etjanst.domstol.se/sok/publicering/1060d9c9-f37e-4fbd-a369-586faf2a9dbb",
  "correlation_number": "1060d9c9-f37e-4fbd-a369-586faf2a9dbb",
  "full_text": "Sök rättspraxis\nTillbaka\nSkriv ut\nOm avgörandet\nDomstol:\nHögsta domstolen\nMålnummer:\nÖ 438-24\nAvgörandedatum:\n2025-03-28\nEuroparättsligt avgörande:\nJa\nLagrum\n13 kap. 2 § rättegångsbalken (1942:740)\n1942:740\n17 kap. 3 § rättegångsbalken (1942:740)\n1942:740\n41 kap. 18 § rättegångsbalken (1942:740)\n1942:740\nEuropakonventionen artikel 13\nHänvisade rättsfall\n”Truebell” NJA 1977 s. 349\n”Den medgivna hävningen” NJA 1986 s. 205\n”Miljöprocesserna i USA” NJA 2013 s. 209\n”Flygbolagets medgivande” NJA 2021 s. 1093\n”Klimattalan” Högsta domstolens beslut den 19 februari 2025 i mål Ö 7177-23\nNyckelord\nMedgivande\nDispositionsprincipen\nFastställelsetalan\nSkadestånd\nÖ 438-24\n”Regionens medgivande”\nI ett mål rörande skadestånd på grund av en överträdelse av grundläggande fri- och rättigheter har svaranden medgett betalning, men förklarat att medgivandet inte innebär ett erkännande av någon överträdelse (ett s.k. orent medgivande). Domstolen bör i en sådan situation tillämpa de processrättsliga bestämmelserna på så sätt att domstolen dömer i enlighet med medgivandet och samtidigt, inom ramen för en fastställelsetalan, tar ställning till om det har förekommit en rättighetsöverträdelse.\n- Visa mindre innehåll\nDom eller beslut\npicture_as_pdf\nÖ 438-24.pdf\narrow_forward\nÖppnas i en ny flik\nKontakt\nFrågor och svar\nTillgänglighet\nPrenumerera på RSS-flöde"
}