{
  "case_number": "B 6596-24",
  "nickname": "”Mordet i Hagalund” ",
  "summary": "När en omyndig ung lagöverträdare döms för brott med ett straffvärde motsvarande livstids fängelse bör ungdomsreduktionen beräknas med utgångspunkt i ett fängelsestraff om arton år. Det finns emellertid härutöver utrymme att i skärpande riktning ta hänsyn till omständigheterna vid brottet och till att personen döms för ytterligare allvarlig brottslighet.",
  "decision_date": "2025-03-25",
  "publication_time": "2025-03-27T10:08:00",
  "case_id": "efd3fd8f-fcc8-443a-a3ee-cbce5da41228",
  "type": "DOM_ELLER_BESLUT",
  "is_precedent": true,
  "court": "Högsta domstolen",
  "court_code": "HDO",
  "keywords": [
    "Brottspåföljd",
    "Livstids fängelse",
    "Mord",
    "Unga lagöverträdare",
    "Ungdomsreduktion"
  ],
  "legal_areas": [],
  "legal_references": [
    {
      "reference": "3 kap. 1 § brottsbalken (1962:700)",
      "sfs_number": "1962:700"
    },
    {
      "reference": "29 kap. 7 § brottsbalken (1962:700)",
      "sfs_number": "1962:700"
    }
  ],
  "referenced_publications": [
    "”Skånerånen” NJA 2000 s. 421",
    "”Tidsbestämningen I–III”  NJA 2008 s. 579 I–III",
    "”Bajonettmordet” NJA 2013 s. 376",
    "”Mordstraffskalan” NJA 2016 s. 3",
    "”Mordet med kökskniven” NJA 2021 s. 32"
  ],
  "pdf_documents": [
    {
      "filename": "2025-03-25 B 6596-24 Dom.pdf",
      "file_id": "190/67/00/67003eca-0ec7-4cef-a3f2-24945f69c4b5"
    }
  ],
  "case_url": "https://rattspraxis.etjanst.domstol.se/sok/publicering/eaef327b-3e87-41ed-a7cf-10a456f0eda1",
  "correlation_number": "eaef327b-3e87-41ed-a7cf-10a456f0eda1",
  "full_text": "Sök rättspraxis\nTillbaka\nSkriv ut\nOm avgörandet\nDomstol:\nHögsta domstolen\nMålnummer:\nB 6596-24\nAvgörandedatum:\n2025-03-25\nLagrum\n3 kap. 1 § brottsbalken (1962:700)\n1962:700\n29 kap. 7 § brottsbalken (1962:700)\n1962:700\nHänvisade rättsfall\n”Skånerånen” NJA 2000 s. 421\n”Tidsbestämningen I–III” NJA 2008 s. 579 I–III\n”Bajonettmordet” NJA 2013 s. 376\n”Mordstraffskalan” NJA 2016 s. 3\n”Mordet med kökskniven” NJA 2021 s. 32\nNyckelord\nBrottspåföljd\nLivstids fängelse\nMord\nUnga lagöverträdare\nUngdomsreduktion\nB 6596-24\n”Mordet i Hagalund”\nNär en omyndig ung lagöverträdare döms för brott med ett straffvärde motsvarande livstids fängelse bör ungdomsreduktionen beräknas med utgångspunkt i ett fängelsestraff om arton år. Det finns emellertid härutöver utrymme att i skärpande riktning ta hänsyn till omständigheterna vid brottet och till att personen döms för ytterligare allvarlig brottslighet.\nDom eller beslut\npicture_as_pdf\n2025-03-25 B 6596-24 Dom.pdf\narrow_forward\nÖppnas i en ny flik\nKontakt\nFrågor och svar\nTillgänglighet\nPrenumerera på RSS-flöde"
}