{
  "case_number": "Ö 4412-24",
  "nickname": "”Resning och påföljdsbestämning”",
  "summary": "Resningsärende. Hovrätten har bestämt tiden för sluten ungdomsvård utan att redovisa hur rätten har förhållit sig till frågan om frihetsberövandet bör reduceras med hänsyn till att någon villkorlig frigivning inte kan ske. Rättstillämpningen har inte ansetts uppenbart strida mot lag, eftersom längden av den slutna ungdomsvården vid en sammantagen bedömning inte uppenbart saknat fog.  ",
  "decision_date": "2025-02-14",
  "publication_time": "2025-04-12T06:04:00",
  "case_id": "37c732cb-ec60-4ce8-9ca7-a6228459f7b8",
  "type": "DOM_ELLER_BESLUT",
  "is_precedent": true,
  "court": "Högsta domstolen",
  "court_code": "HDO",
  "keywords": [
    "Resning",
    "Brottspåföljd",
    "Sluten ungdomsvård"
  ],
  "legal_areas": [],
  "legal_references": [
    {
      "reference": "58 kap. 2 § rättegångsbalken (1942:740)",
      "sfs_number": "1942:740"
    }
  ],
  "referenced_publications": [
    "”Tjänstemannens straff” NJA 1987 s. 459"
  ],
  "pdf_documents": [
    {
      "filename": "Ö 4412-24.pdf",
      "file_id": "190/ee/9c/ee9ca1f5-6745-4dcf-9861-1e09217f6d21"
    }
  ],
  "case_url": "https://rattspraxis.etjanst.domstol.se/sok/publicering/57d92669-016a-4256-839b-425dba1d226c",
  "correlation_number": "57d92669-016a-4256-839b-425dba1d226c",
  "full_text": "Sök rättspraxis\nTillbaka\nSkriv ut\nOm avgörandet\nDomstol:\nHögsta domstolen\nMålnummer:\nÖ 4412-24\nAvgörandedatum:\n2025-02-14\nLagrum\n58 kap. 2 § rättegångsbalken (1942:740)\n1942:740\nHänvisade rättsfall\n”Tjänstemannens straff” NJA 1987 s. 459\nNyckelord\nResning\nBrottspåföljd\nSluten ungdomsvård\nÖ 4412-24\n”Resning och påföljdsbestämning”\nResningsärende. Hovrätten har bestämt tiden för sluten ungdomsvård utan att redovisa hur rätten har förhållit sig till frågan om frihetsberövandet bör reduceras med hänsyn till att någon villkorlig frigivning inte kan ske. Rättstillämpningen har inte ansetts uppenbart strida mot lag, eftersom längden av den slutna ungdomsvården vid en sammantagen bedömning inte uppenbart saknat fog.\nDom eller beslut\npicture_as_pdf\nÖ 4412-24.pdf\narrow_forward\nÖppnas i en ny flik\nKontakt\nFrågor och svar\nTillgänglighet\nPrenumerera på RSS-flöde"
}